title,directors,actors,genre,comb
kahaani,Sujoy Ghosh,Vidya Balan   Parambrata Chatterjee   Dhritiman Chatterjee   Saswata Chatterjee,Drama   Mystery   Thriller,Sujoy Ghosh Vidya Balan   Parambrata Chatterjee   Dhritiman Chatterjee   Saswata Chatterjee Drama   Mystery   Thriller
united six,Vishal Aryan Singh,Brahim Achabbakhe   Russell Geoffrey Banks   Leigh Barwell   Isha Batwe,Action   Drama   Thriller,Vishal Aryan Singh Brahim Achabbakhe   Russell Geoffrey Banks   Leigh Barwell   Isha Batwe Action   Drama   Thriller
angel,Ganesh Acharya,Sumit Arora   Arun   Raakesh Babu   Prem Kishen Dwivedi,Action   Drama,Ganesh Acharya Sumit Arora   Arun   Raakesh Babu   Prem Kishen Dwivedi Action   Drama
hostel,Manish Gupta,Vatsal Seth   Tulip Joshi   Mukesh Tiwari   Nagesh Bhonsle,Action   Crime   Drama,Manish Gupta Vatsal Seth   Tulip Joshi   Mukesh Tiwari   Nagesh Bhonsle Action   Crime   Drama
shagird,Tigmanshu Dhulia,Nana Patekar   Mohit Ahlawat   Rimi Sen   Anurag Kashyap,Action   Crime   Drama,Tigmanshu Dhulia Nana Patekar   Mohit Ahlawat   Rimi Sen   Anurag Kashyap Action   Crime   Drama
rascals,David Dhawan,Ajay Devgn   Sanjay Dutt   Kangana Ranaut   Lisa Haydon,Action   Comedy   Crime,David Dhawan Ajay Devgn   Sanjay Dutt   Kangana Ranaut   Lisa Haydon Action   Comedy   Crime
dhoom: 3,Vijay Krishna Acharya,Aamir Khan   Katrina Kaif   Tabrett Bethell   Abhishek Bachchan,Action   Crime   Thriller,Vijay Krishna Acharya Aamir Khan   Katrina Kaif   Tabrett Bethell   Abhishek Bachchan Action   Crime   Thriller
kaccha limboo,Sagar Ballary,Bhairavi Goswami   Iravati Harshe   Chinmay Kambli   Rajesh Khattar,Comedy   Family,Sagar Ballary Bhairavi Goswami   Iravati Harshe   Chinmay Kambli   Rajesh Khattar Comedy   Family
shaitan,Bejoy Nambiar,Kalki Koechlin   Shiv Pandit   Gulshan Devaiah   Rajeev Khandelwal,Action   Crime   Drama,Bejoy Nambiar Kalki Koechlin   Shiv Pandit   Gulshan Devaiah   Rajeev Khandelwal Action   Crime   Drama
rockstar,Imtiaz Ali,Ranbir Kapoor   Nargis Fakhri   Shammi Kapoor   Kumud Mishra,Music   Musical,Imtiaz Ali Ranbir Kapoor   Nargis Fakhri   Shammi Kapoor   Kumud Mishra Music   Musical
chillar party,Vikas Bahl   Nitesh Tiwari,Aarav Khanna   Chinmai Chandranshuh   Divji Handa   Irfan Khan,Comedy   Drama   Family,Vikas Bahl   Nitesh Tiwari Aarav Khanna   Chinmai Chandranshuh   Divji Handa   Irfan Khan Comedy   Drama   Family
u r my jaan,Aron Govil,Mikaal   Preeti   Himani Shivpuri   Anil Dhawan,Romance,Aron Govil Mikaal   Preeti   Himani Shivpuri   Anil Dhawan Romance
aarakshan,Prakash Jha,Amitabh Bachchan   Saif Ali Khan   Manoj Bajpayee   Deepika Padukone,Drama   Thriller,Prakash Jha Amitabh Bachchan   Saif Ali Khan   Manoj Bajpayee   Deepika Padukone Drama   Thriller
agneepath,Karan Malhotra,Hrithik Roshan   Priyanka Chopra   Sanjay Dutt   Rishi Kapoor,Action   Crime   Drama,Karan Malhotra Hrithik Roshan   Priyanka Chopra   Sanjay Dutt   Rishi Kapoor Action   Crime   Drama
qasam se qasam se,Ashfaque Makrani,Faith   Farhan   Satish Kaushik   Omkar Das Manikpuri,Romance,Ashfaque Makrani Faith   Farhan   Satish Kaushik   Omkar Das Manikpuri Romance
teen thay bhai,Mrigdeep Singh Lamba,Om Puri   Deepak Dobriyal   Ragini Khanna   Naresh Gosain,Comedy   Drama,Mrigdeep Singh Lamba Om Puri   Deepak Dobriyal   Ragini Khanna   Naresh Gosain Comedy   Drama
bbuddah hoga terra baap,Puri Jagannadh,Amitabh Bachchan   Hema Malini   Sonu Sood   Sonal Chauhan,Action   Crime   Drama,Puri Jagannadh Amitabh Bachchan   Hema Malini   Sonu Sood   Sonal Chauhan Action   Crime   Drama
love breakups zindagi,Sahil Sangha,Zayed Khan   Dia Mirza   Cyrus Sahukar   Tisca Chopra,Comedy   Drama   Romance,Sahil Sangha Zayed Khan   Dia Mirza   Cyrus Sahukar   Tisca Chopra Comedy   Drama   Romance
404: error not found,Prawaal Raman,Sara Arjun   Rajvvir Aroraa   Aditya Banerjee   Mukesh Bhatt,Drama   Mystery   Thriller,Prawaal Raman Sara Arjun   Rajvvir Aroraa   Aditya Banerjee   Mukesh Bhatt Drama   Mystery   Thriller
chalo dilli,Shashant Shah,Vinay Pathak   Lara Dutta   Yana Gupta   Akshay Kumar,Comedy   Drama,Shashant Shah Vinay Pathak   Lara Dutta   Yana Gupta   Akshay Kumar Comedy   Drama
satrangee parachute,Vineet Khetrapal,Sanjay Mishra   Zakir Hussain   Lilliput   Rupali Ganguly,Comedy   Drama   Family,Vineet Khetrapal Sanjay Mishra   Zakir Hussain   Lilliput   Rupali Ganguly Comedy   Drama   Family
haunted - 3d,Vikram Bhatt,Tia Bajpai   Krishna Bhatt   Mimoh Chakraborty   Nikita Janjani,Horror   Mystery   Thriller,Vikram Bhatt Tia Bajpai   Krishna Bhatt   Mimoh Chakraborty   Nikita Janjani Horror   Mystery   Thriller
monica,Sushen Bhatnagar,Ashutosh Rana   Divya Dutta   Rajit Kapoor   Yashpal Sharma,Drama   Thriller,Sushen Bhatnagar Ashutosh Rana   Divya Dutta   Rajit Kapoor   Yashpal Sharma Drama   Thriller
ragini mms,Pawan Kripalani,Kainaz Motivala   Rajkummar Rao   Rajat Kaul   Janice,Drama   Horror   Mystery,Pawan Kripalani Kainaz Motivala   Rajkummar Rao   Rajat Kaul   Janice Drama   Horror   Mystery
once upon a time in mumbai dobaara!,Milan Luthria,Akshay Kumar   Pitobash   Sonakshi Sinha   Imran Khan,Action   Crime   Drama,Milan Luthria Akshay Kumar   Pitobash   Sonakshi Sinha   Imran Khan Action   Crime   Drama
ye stupid pyar,Jain Rakesh,Jatin Khurana   Noopur Patwardhan   Akansha   Sahil Vaid,Romance,Jain Rakesh Jatin Khurana   Noopur Patwardhan   Akansha   Sahil Vaid Romance
masti express,Vikram Pradhan,Rajpal Yadav   Johnny Lever   Divya Dutta   Jaikumar Banotia,Comedy   Drama,Vikram Pradhan Rajpal Yadav   Johnny Lever   Divya Dutta   Jaikumar Banotia Comedy   Drama
vikalp,Sachin P. Karande,Pankaj Berry   Abhay Joshi   Jyoti Joshi   Abhijeet Leheri,Crime   Drama   Mystery,Sachin P. Karande Pankaj Berry   Abhay Joshi   Jyoti Joshi   Abhijeet Leheri Crime   Drama   Mystery
mumbai mast kallander,Musavir Jaleel   Aman Mihani,Mohsin   Muzzi   Shilpa Shukla   Luna,Action   Comedy   Crime,Musavir Jaleel   Aman Mihani Mohsin   Muzzi   Shilpa Shukla   Luna Action   Comedy   Crime
tum hi to ho...,Sanjay Goel,Vipinno   Madhavi Sharma   Sarvar Ahuja   Vivek Shaq,Drama   Mystery   Thriller,Sanjay Goel Vipinno   Madhavi Sharma   Sarvar Ahuja   Vivek Shaq Drama   Mystery   Thriller
men will be men,Gorky,Gaurav Chopra   Zeenal Kamdar   Rajesh Khattar   Rohit Khuranna,Comedy,Gorky Gaurav Chopra   Zeenal Kamdar   Rajesh Khattar   Rohit Khuranna Comedy
bengaloored,Swaroop Kanchi,Harish Raj   Meghana Mudiyam   Srinivasa Prabhu   Lakshmi Chandrashekar,Drama   Romance,Swaroop Kanchi Harish Raj   Meghana Mudiyam   Srinivasa Prabhu   Lakshmi Chandrashekar Drama   Romance
the camp,Nitin Mahadar,Sonali Kulkarni   Sanjay Mishra   Rakesh Bedi   Krishna Bhatt,Adventure   Drama,Nitin Mahadar Sonali Kulkarni   Sanjay Mishra   Rakesh Bedi   Krishna Bhatt Adventure   Drama
shor in the city,Krishna D.K.   Raj Nidimoru,Sendhil Ramamurthy   Tusshar Kapoor   Nikhil Dwivedi   Preeti Desai,Crime   Drama,Krishna D.K.   Raj Nidimoru Sendhil Ramamurthy   Tusshar Kapoor   Nikhil Dwivedi   Preeti Desai Crime   Drama
5ters: castle of dark master,G. Venugopal,Akash   Avinash   Gagan   Hithaishaini,Action   Adventure   Fantasy,G. Venugopal Akash   Avinash   Gagan   Hithaishaini Action   Adventure   Fantasy
a strange love story,Tarique Khan   Sahil Seth,Gunjan Bakshi   Snehal Dabi   Milind Gunaji   Ehsan Khan,Drama,Tarique Khan   Sahil Seth Gunjan Bakshi   Snehal Dabi   Milind Gunaji   Ehsan Khan Drama
joker,Shirish Kunder,Asrani   Avtar Gill   Gurpreet Guggi   Greg Heffernan,Comedy   Sci-Fi,Shirish Kunder Asrani   Avtar Gill   Gurpreet Guggi   Greg Heffernan Comedy   Sci-Fi
luv ka the end,Bumpy,Riya Bamniyal   Bumpy   Sreejita De   Shraddha Kapoor,Comedy   Drama,Bumpy Riya Bamniyal   Bumpy   Sreejita De   Shraddha Kapoor Comedy   Drama
murder 2,Mohit Suri,Jacqueline Fernandez   Yana Gupta   Emraan Hashmi   Amardeep Jha,Action   Crime   Drama,Mohit Suri Jacqueline Fernandez   Yana Gupta   Emraan Hashmi   Amardeep Jha Action   Crime   Drama
khuda kasam,K.C. Bokadia,Beena Banerjee   Sunny Deol   Farida Jalal   Raza Murad,Action   Crime   Drama,K.C. Bokadia Beena Banerjee   Sunny Deol   Farida Jalal   Raza Murad Action   Crime   Drama
queens! destiny of dance,David Atkins,Seema Biswas,Musical,David Atkins Seema Biswas Musical
pyaar ka punchnama,Luv Ranjan,Raayo S. Bakhirta   Nushrat Bharucha   Padam Bhola   Sonalli Sehgal,Comedy   Drama   Romance,Luv Ranjan Raayo S. Bakhirta   Nushrat Bharucha   Padam Bhola   Sonalli Sehgal Comedy   Drama   Romance
mallika,Wilson Louis,Anirudh Agarwal   Puja Ballutia   Sammir Dattani   Dunger,Drama   Horror   Mystery,Wilson Louis Anirudh Agarwal   Puja Ballutia   Sammir Dattani   Dunger Drama   Horror   Mystery
delhi belly,Abhinay Deo   Akshat Verma,Imran Khan   Vir Das   Kunaal Roy Kapur   Shenaz Treasury,Comedy   Crime   Drama,Abhinay Deo   Akshat Verma Imran Khan   Vir Das   Kunaal Roy Kapur   Shenaz Treasury Comedy   Crime   Drama
nakshatra,Mohan Savalkar,Malaika Arora   Suresh Chatwal   Gajendra Chouhan   Anant Jog,Crime   Drama   Mystery,Mohan Savalkar Malaika Arora   Suresh Chatwal   Gajendra Chouhan   Anant Jog Crime   Drama   Mystery
always kabhi kabhi,Roshan Abbas,Lillete Dubey   Satyajeet Dubey   Ali Fazal   Manoj Joshi,Comedy   Crime   Drama,Roshan Abbas Lillete Dubey   Satyajeet Dubey   Ali Fazal   Manoj Joshi Comedy   Crime   Drama
vroom,Savin Tuscano,Raj Singh Arora   Gaurav Bajaj   Kalpana Bora   Kishore Chougule,Action   Comedy   Crime,Savin Tuscano Raj Singh Arora   Gaurav Bajaj   Kalpana Bora   Kishore Chougule Action   Comedy   Crime
bheja fry 2,Sagar Ballary,Vinay Pathak   Kay Kay Menon   Minissha Lamba   Rukhsar,Comedy   Drama,Sagar Ballary Vinay Pathak   Kay Kay Menon   Minissha Lamba   Rukhsar Comedy   Drama
soundtrack,Neerav Ghosh,Rajeev Khandelwal   Soha Ali Khan   Mrinalini Sharma   Mohan Kapoor,Drama   Musical,Neerav Ghosh Rajeev Khandelwal   Soha Ali Khan   Mrinalini Sharma   Mohan Kapoor Drama   Musical
kucch luv jaisaa,Shukla Barnali Ray,Shefali Shetty   Om Puri   Rahul Bose   Neetu Chandra,Crime   Drama   Thriller,Shukla Barnali Ray Shefali Shetty   Om Puri   Rahul Bose   Neetu Chandra Crime   Drama   Thriller
bin bulaye baraati,Chandrakant Singh,Rati Agnihotri   Shweta Bhardwaj   Gulshan Grover   Manoj Joshi,Action   Comedy   Crime,Chandrakant Singh Rati Agnihotri   Shweta Bhardwaj   Gulshan Grover   Manoj Joshi Action   Comedy   Crime
impatient vivek,Rahat Kazmi,Vivek Sudershan   Sayali Bhagat   Ronnaoq Ahuja   Chari Asopa,Comedy   Drama   Romance,Rahat Kazmi Vivek Sudershan   Sayali Bhagat   Ronnaoq Ahuja   Chari Asopa Comedy   Drama   Romance
singham,Rohit Shetty,Ajay Devgn   Kajal Agarwal   Prakash Raj   Sonali Kulkarni,Action   Crime   Drama,Rohit Shetty Ajay Devgn   Kajal Agarwal   Prakash Raj   Sonali Kulkarni Action   Crime   Drama
the waiting room,Maneej Premnath,Raj Singh Chaudhary   Radhika Apte   Sandeep Kulkarni   Prateeksha Lonkar,Crime   Drama   Mystery,Maneej Premnath Raj Singh Chaudhary   Radhika Apte   Sandeep Kulkarni   Prateeksha Lonkar Crime   Drama   Mystery
heroine,Madhur Bhandarkar,Kareena Kapoor   Arjun Rampal   Randeep Hooda   Shahana Goswami,Drama,Madhur Bhandarkar Kareena Kapoor   Arjun Rampal   Randeep Hooda   Shahana Goswami Drama
the dirty picture,Milan Luthria,Vidya Balan   Emraan Hashmi   Tusshar Kapoor   Naseeruddin Shah,Biography   Comedy   Drama,Milan Luthria Vidya Balan   Emraan Hashmi   Tusshar Kapoor   Naseeruddin Shah Biography   Comedy   Drama
gangs of wasseypur,Anurag Kashyap,Manoj Bajpayee   Richa Chadda   Nawazuddin Siddiqui   Tigmanshu Dhulia,Action   Crime   Drama,Anurag Kashyap Manoj Bajpayee   Richa Chadda   Nawazuddin Siddiqui   Tigmanshu Dhulia Action   Crime   Drama
ladies vs. ricky bahl,Maneesh Sharma,Ranveer Singh   Anushka Sharma   Parineeti Chopra   Dipannita Sharma,Comedy   Drama,Maneesh Sharma Ranveer Singh   Anushka Sharma   Parineeti Chopra   Dipannita Sharma Comedy   Drama
ata pata lapatta,Rajpal Yadav,Asrani   Amit Behl   Krishna Bhatt   Raja Bherwani,Comedy   Musical,Rajpal Yadav Asrani   Amit Behl   Krishna Bhatt   Raja Bherwani Comedy   Musical
good luck!,Aditya Datt,Aryeman Ramsay   Sayali Bhagat   Sharat Saxena   Archana Puran Singh,Comedy   Drama,Aditya Datt Aryeman Ramsay   Sayali Bhagat   Sharat Saxena   Archana Puran Singh Comedy   Drama
tell me o kkhuda,Hema Malini,Dharmendra   Vinod Khanna   Rishi Kapoor   Farooq Shaikh,Action   Crime   Drama,Hema Malini Dharmendra   Vinod Khanna   Rishi Kapoor   Farooq Shaikh Action   Crime   Drama
love express,Sunny Bhambhani,Sahil Mehta   Mannat Ravi   Vikas Katyal   Priyam Galav,Comedy   Drama,Sunny Bhambhani Sahil Mehta   Mannat Ravi   Vikas Katyal   Priyam Galav Comedy   Drama
suno na.. ek nanhi aawaz,Amy Thanawala,Tara Sharma   Makrand Shukla   Rajendra Chawla   Rinku Patel,Drama,Amy Thanawala Tara Sharma   Makrand Shukla   Rajendra Chawla   Rinku Patel Drama
chala mussaddi - office office,Rajiv Mehra,Deven Bhojani   Makrand Deshpande   Vinay Jain   Farida Jalal,Comedy   Drama,Rajiv Mehra Deven Bhojani   Makrand Deshpande   Vinay Jain   Farida Jalal Comedy   Drama
gandhi to hitler,Rakesh Ranjan Kumar,Raghuvir Yadav   Neha Dhupia   Aman Verma   Nassar Abdulla,Drama   History   War,Rakesh Ranjan Kumar Raghuvir Yadav   Neha Dhupia   Aman Verma   Nassar Abdulla Drama   History   War
housefull 2,Sajid Khan,Akshay Kumar   Asin   John Abraham   Jacqueline Fernandez,Comedy   Romance,Sajid Khan Akshay Kumar   Asin   John Abraham   Jacqueline Fernandez Comedy   Romance
dekh bhai dekh: laughter behind darkness,Rahat Kazmi,Gracy Singh   Siddharth Koirala   Raghuvir Yadav   Vijay Raaz,Comedy   Crime   Drama,Rahat Kazmi Gracy Singh   Siddharth Koirala   Raghuvir Yadav   Vijay Raaz Comedy   Crime   Drama
desi boyz,Rohit Dhawan,Bruna Abdullah   John Abraham   Shekhar Bassi   Peter Brown,Comedy   Drama,Rohit Dhawan Bruna Abdullah   John Abraham   Shekhar Bassi   Peter Brown Comedy   Drama
ishkq in paris,Prem Soni,Preity Zinta   Isabelle Adjani   Gaurav Chanana   Fanny Carbonnel,Comedy   Romance,Prem Soni Preity Zinta   Isabelle Adjani   Gaurav Chanana   Fanny Carbonnel Comedy   Romance
chal chalein,Ujjwal Singh,Javed Abedi   Anand Abhyankar   Adityansh   Lalit Agarwal,Drama,Ujjwal Singh Javed Abedi   Anand Abhyankar   Adityansh   Lalit Agarwal Drama
force,Nishikant Kamat,John Abraham   Genelia D'Souza   Raj Babbar   Mohnish Bahl,Action   Crime   Drama,Nishikant Kamat John Abraham   Genelia D'Souza   Raj Babbar   Mohnish Bahl Action   Crime   Drama
toss: a flip of destiny,Ramesh Khatkar,Rannvijay Singh   Madhurima Banerjee   Prashant Raj   Ashmit Patel,Crime   Drama   Thriller,Ramesh Khatkar Rannvijay Singh   Madhurima Banerjee   Prashant Raj   Ashmit Patel Crime   Drama   Thriller
aamras: the sweet taste of friendship,Rupali Guha,Vega Tamotia   Ntasha Bhardwaj   Maanvi Gagroo   Aanchal Sabharwal,Drama,Rupali Guha Vega Tamotia   Ntasha Bhardwaj   Maanvi Gagroo   Aanchal Sabharwal Drama
bachelor party,Ishaan Trivedi,Jimmy Shergill   Arbaaz Khan   Nauheed Cyrusi   Sharat Saxena,Comedy   Drama,Ishaan Trivedi Jimmy Shergill   Arbaaz Khan   Nauheed Cyrusi   Sharat Saxena Comedy   Drama
cycle kick,Shashi Sudigala,Nishan Nanaiah   Sunny Hinduja   Girija Oak   Ishita Sharma,Drama   Sport,Shashi Sudigala Nishan Nanaiah   Sunny Hinduja   Girija Oak   Ishita Sharma Drama   Sport
not a love story,Ram Gopal Varma,Rohit G. Banawlikar   Deepak Dobriyal   Ajay Gehi   Mahie Gill,Crime   Drama   Thriller,Ram Gopal Varma Rohit G. Banawlikar   Deepak Dobriyal   Ajay Gehi   Mahie Gill Crime   Drama   Thriller
ashok chakra: tribute to real heroes,S.P. Muneshwar,Rajan Verma   Sudesh Berry   Arun Bakshi   Sandip Munde,Action,S.P. Muneshwar Rajan Verma   Sudesh Berry   Arun Bakshi   Sandip Munde Action
bubble gum,Sanjivan Lal,Apoorva Arora   Apporva Arora   Tanvi Azmi   Delzad Hiwale,Drama,Sanjivan Lal Apoorva Arora   Apporva Arora   Tanvi Azmi   Delzad Hiwale Drama
aagaah: the warning,Karan Razdan,Ila Arun   Anang Desai   Zakir Hussain   Satish Kaushik,Drama   Horror   Thriller,Karan Razdan Ila Arun   Anang Desai   Zakir Hussain   Satish Kaushik Drama   Horror   Thriller
ek tha tiger,Kabir Khan,Salman Khan   Katrina Kaif   Ranvir Shorey   Girish Karnad,Action   Romance   Thriller,Kabir Khan Salman Khan   Katrina Kaif   Ranvir Shorey   Girish Karnad Action   Romance   Thriller
phhir,Girish Dhamija,Mohan Agashe   Kasturi Banerjee   Roshni Chopra   Rajneesh Duggal,Drama   Mystery   Romance,Girish Dhamija Mohan Agashe   Kasturi Banerjee   Roshni Chopra   Rajneesh Duggal Drama   Mystery   Romance
kyaa super kool hain hum,Sachin Yardi,Anupam Kher   Ritesh Deshmukh   Rohit Shetty   Tusshar Kapoor,Comedy,Sachin Yardi Anupam Kher   Ritesh Deshmukh   Rohit Shetty   Tusshar Kapoor Comedy
stand by,Sanjay Soorkar,Siddharth Kher   Sachin Khedekar   Dalip Tahil   Nagesh Bhonsle,Drama   Sport   Thriller,Sanjay Soorkar Siddharth Kher   Sachin Khedekar   Dalip Tahil   Nagesh Bhonsle Drama   Sport   Thriller
shabri,Lalit Marathe,Isha Koppikar   Raj Arjun   Manish Wadhwa   Pradeep Singh Rawat,Action   Crime   Drama,Lalit Marathe Isha Koppikar   Raj Arjun   Manish Wadhwa   Pradeep Singh Rawat Action   Crime   Drama
hair is falling: a serious comedy film,Vicky Bhardwaj,Rajesh Bhardwaj   Sanjana Tiwari   Priyanka   Mahender Singh Bist,Comedy   Drama,Vicky Bhardwaj Rajesh Bhardwaj   Sanjana Tiwari   Priyanka   Mahender Singh Bist Comedy   Drama
aazaan,Prashant Chadha,Sachiin Joshi   Candice Boucher   Arya Babbar   Samy Gharbi,Action   Drama   Mystery,Prashant Chadha Sachiin Joshi   Candice Boucher   Arya Babbar   Samy Gharbi Action   Drama   Mystery
hum tum shabana,Sagar Ballary,Tusshar Kapoor   Shreyas Talpade   Minissha Lamba   Mantra,Comedy   Crime   Drama,Sagar Ballary Tusshar Kapoor   Shreyas Talpade   Minissha Lamba   Mantra Comedy   Crime   Drama
hum do anjaane,Milind Swamy,Naresh Kaura   Ankita Bhargava   Jackie Shroff   Avtar Gill,Action   Crime   Drama,Milind Swamy Naresh Kaura   Ankita Bhargava   Jackie Shroff   Avtar Gill Action   Crime   Drama
mod,Nagesh Kukunoor,Ayesha Takia   Rannvijay Singh   Raghuvir Yadav   Tanvi Azmi,Drama   Romance   Thriller,Nagesh Kukunoor Ayesha Takia   Rannvijay Singh   Raghuvir Yadav   Tanvi Azmi Drama   Romance   Thriller
jaana pehchana,Sachin,Birbal   Pushkar Jog   Ranjeeta Kaur   Neelu Kohli,Drama,Sachin Birbal   Pushkar Jog   Ranjeeta Kaur   Neelu Kohli Drama
mujhse fraaandship karoge,Nupur Asthana,Saqib Saleem   Saba Azaad   Nishant Dahiya   Tara D'Souza,Comedy   Drama   Romance,Nupur Asthana Saqib Saleem   Saba Azaad   Nishant Dahiya   Tara D'Souza Comedy   Drama   Romance
maruti mera dosst,Manikya Raju,Shahbaaz Khan   Sushmita Mukherjee   Erik A. Nanda   Ritika Shah,Animation   Adventure   Drama,Manikya Raju Shahbaaz Khan   Sushmita Mukherjee   Erik A. Nanda   Ritika Shah Animation   Adventure   Drama
kya dilli kya lahore,Vijay Raaz   Karan Arora,Vijay Raaz   Manu Rishi Chadha   Rajendranath Zutshi   Vishwajeet Pradhan,Drama   History   War,Vijay Raaz   Karan Arora Vijay Raaz   Manu Rishi Chadha   Rajendranath Zutshi   Vishwajeet Pradhan Drama   History   War
"i, me aur main",Kapil Sharma,John Abraham   Chitrangda Singh   Prachi Desai   Mini Mathur,Drama,Kapil Sharma John Abraham   Chitrangda Singh   Prachi Desai   Mini Mathur Drama
london paris new york,Anu Menon,Ali Zafar   Aditi Rao Hydari   Candice Pereira   Scherrikar Bell,Romance,Anu Menon Ali Zafar   Aditi Rao Hydari   Candice Pereira   Scherrikar Bell Romance
lottery,Hemant Prabhu,Abhijeet   Rucha Gujrati   Manisha Kelkar   Nassar Abdulla,Crime   Drama   Mystery,Hemant Prabhu Abhijeet   Rucha Gujrati   Manisha Kelkar   Nassar Abdulla Crime   Drama   Mystery
shortcut romeo,Susi Ganesan,Neil Nitin Mukesh   Ameesha Patel   Puja Gupta   Jatin Grewal,Action   Crime   Romance,Susi Ganesan Neil Nitin Mukesh   Ameesha Patel   Puja Gupta   Jatin Grewal Action   Crime   Romance
jugaad,R. Anand Kumar,Manoj Bajpayee   Hrishitaa Bhatt   Vijay Raaz   Govind Namdeo,Comedy   Drama,R. Anand Kumar Manoj Bajpayee   Hrishitaa Bhatt   Vijay Raaz   Govind Namdeo Comedy   Drama
mummy punjabi: superman ki bhi maa!!,Pammi Somal,Kiron Kher   Kanwaljit Singh   Jackie Shroff   Anju Mahendru,Comedy   Drama,Pammi Somal Kiron Kher   Kanwaljit Singh   Jackie Shroff   Anju Mahendru Comedy   Drama
shanghai,Dibakar Banerjee,Emraan Hashmi   Abhay Deol   Prasenjit Chatterjee   Kalki Koechlin,Crime   Thriller,Dibakar Banerjee Emraan Hashmi   Abhay Deol   Prasenjit Chatterjee   Kalki Koechlin Crime   Thriller
saheb biwi aur gangster,Tigmanshu Dhulia,Randeep Hooda   Mahie Gill   Jimmy Shergill   Shreya Narayan,Action   Crime   Drama,Tigmanshu Dhulia Randeep Hooda   Mahie Gill   Jimmy Shergill   Shreya Narayan Action   Crime   Drama
rowdy rathore,Prabhudheva,Akshay Kumar   Sonakshi Sinha   Nasser   Paresh Ganatra,Action   Comedy,Prabhudheva Akshay Kumar   Sonakshi Sinha   Nasser   Paresh Ganatra Action   Comedy
barfi!,Anurag Basu,Ranbir Kapoor   Priyanka Chopra   Ileana   Saurabh Shukla,Adventure   Comedy   Drama,Anurag Basu Ranbir Kapoor   Priyanka Chopra   Ileana   Saurabh Shukla Adventure   Comedy   Drama
jo dooba so paar: it's love in bihar!,Praveen Kumar,Anand Tiwari   Rajat Kapoor   Sita Spada   Dadhi Raj,Comedy   Crime   Drama,Praveen Kumar Anand Tiwari   Rajat Kapoor   Sita Spada   Dadhi Raj Comedy   Crime   Drama
inkaar,Sudhir Mishra,Arjun Rampal   Chitrangda Singh   Vipin Sharma   Mithun Rodwittiya,Drama   Romance,Sudhir Mishra Arjun Rampal   Chitrangda Singh   Vipin Sharma   Mithun Rodwittiya Drama   Romance
hum hai raahi car ke,Jyotin Goel,Anupam Kher   Sanjay Dutt   Juhi Chawla   Rati Agnihotri,Adventure   Romance,Jyotin Goel Anupam Kher   Sanjay Dutt   Juhi Chawla   Rati Agnihotri Adventure   Romance
miley - naa miley - hum,Tanveer Khan,Chirag Paswan   Kangana Ranaut   Neeru Bajwa   Sagarika Ghatge,Comedy   Drama   Romance,Tanveer Khan Chirag Paswan   Kangana Ranaut   Neeru Bajwa   Sagarika Ghatge Comedy   Drama   Romance
matru ki bijlee ka mandola,Vishal Bhardwaj,Imran Khan   Anushka Sharma   Pankaj Kapur   Lekha Washington,Comedy   Drama,Vishal Bhardwaj Imran Khan   Anushka Sharma   Pankaj Kapur   Lekha Washington Comedy   Drama
shakal pe mat ja,Shubh,Shubh   Pratik Katare   Harsh Parekh   Chitrak Bandyopadhyay,Comedy   Crime   Drama,Shubh Shubh   Pratik Katare   Harsh Parekh   Chitrak Bandyopadhyay Comedy   Crime   Drama
chennai express,Rohit Shetty,Deepika Padukone   Shah Rukh Khan   Satyaraj   Nikitin Dheer,Action   Comedy   Romance,Rohit Shetty Deepika Padukone   Shah Rukh Khan   Satyaraj   Nikitin Dheer Action   Comedy   Romance
dabangg 2,Arbaaz Khan,Salman Khan   Sonakshi Sinha   Prakash Raj   Vinod Khanna,Action   Comedy   Drama,Arbaaz Khan Salman Khan   Sonakshi Sinha   Prakash Raj   Vinod Khanna Action   Comedy   Drama
jo hum chahein,Pawan Gill,Sunny Gill   Simran Kaur Mundi   Alyy Khan   Achint Kaur,Drama   Romance,Pawan Gill Sunny Gill   Simran Kaur Mundi   Alyy Khan   Achint Kaur Drama   Romance
ferrari ki sawaari,Rajesh Mapuskar,Sharman Joshi   Boman Irani   Ritwik Sahore   Paresh Rawal,Crime   Family   Sport,Rajesh Mapuskar Sharman Joshi   Boman Irani   Ritwik Sahore   Paresh Rawal Crime   Family   Sport
ekk deewana tha,Gautham Menon,Prateik   Amy Jackson   Sachin Khedekar   Manu Rishi Chadha,Romance,Gautham Menon Prateik   Amy Jackson   Sachin Khedekar   Manu Rishi Chadha Romance
tere naal love ho gaya,Mandeep Kumar,Ritesh Deshmukh   Genelia D'Souza   Om Puri   Tinnu Anand,Comedy   Romance,Mandeep Kumar Ritesh Deshmukh   Genelia D'Souza   Om Puri   Tinnu Anand Comedy   Romance
lanka,Maqbool Khan,Manoj Bajpayee   Arjan Bajwa   Tia Bajpai   Yashpal Sharma,Action   Crime   Drama,Maqbool Khan Manoj Bajpayee   Arjan Bajwa   Tia Bajpai   Yashpal Sharma Action   Crime   Drama
3 nights 4 days,Devang Dholakia,Hrishitaa Bhatt   Anuj Sawhney,Romance,Devang Dholakia Hrishitaa Bhatt   Anuj Sawhney Romance
raaz 3: the third dimension,Vikram Bhatt,Emraan Hashmi   Bipasha Basu   Esha Gupta   Manish Chaudhary,Horror   Romance   Thriller,Vikram Bhatt Emraan Hashmi   Bipasha Basu   Esha Gupta   Manish Chaudhary Horror   Romance   Thriller
koi hai,Rajiv S. Ruia,Aman Verma   Shweta Menon   Rinku Ghosh   Roop Kumar Rathod,Drama   Horror,Rajiv S. Ruia Aman Verma   Shweta Menon   Rinku Ghosh   Roop Kumar Rathod Drama   Horror
yeh jo mohabbat hai,Shree Narayan Singh,Rati Agnihotri   Mohnish Bahl   Nazia Hussain   Farida Jalal,Drama,Shree Narayan Singh Rati Agnihotri   Mohnish Bahl   Nazia Hussain   Farida Jalal Drama
zindagi tere naam,Ashu Trikha,Mithun Chakraborty   Ranjeeta Kaur   Sajid Ali   Supriya Karnik,Romance,Ashu Trikha Mithun Chakraborty   Ranjeeta Kaur   Sajid Ali   Supriya Karnik Romance
khiladi 786,Ashish R. Mohan,Akshay Kumar   Asin   Raj Babbar   Vipin Bakshi,Action   Comedy,Ashish R. Mohan Akshay Kumar   Asin   Raj Babbar   Vipin Bakshi Action   Comedy
cocktail,Homi Adajania,Deepika Padukone   Saif Ali Khan   Randeep Hooda   Boman Irani,Comedy   Drama   Romance,Homi Adajania Deepika Padukone   Saif Ali Khan   Randeep Hooda   Boman Irani Comedy   Drama   Romance
student of the year,Karan Johar,Sidharth Malhotra   Alia Bhatt   Varun Dhawan   Rishi Kapoor,Comedy   Romance,Karan Johar Sidharth Malhotra   Alia Bhatt   Varun Dhawan   Rishi Kapoor Comedy   Romance
ghost,Puja Bedi,Shiney Ahuja   Sayali Bhagat   Julia Bliss   Tabrez Khan,Horror,Puja Bedi Shiney Ahuja   Sayali Bhagat   Julia Bliss   Tabrez Khan Horror
jab tak hai jaan,Yash Chopra,Shah Rukh Khan   Katrina Kaif   Anushka Sharma   June Smith,Drama   Romance,Yash Chopra Shah Rukh Khan   Katrina Kaif   Anushka Sharma   June Smith Drama   Romance
yeh jawaani hai deewani,Ayan Mukherjee,Ranbir Kapoor   Deepika Padukone   Aditya Roy Kapoor   Kalki Koechlin,Drama   Musical   Romance,Ayan Mukherjee Ranbir Kapoor   Deepika Padukone   Aditya Roy Kapoor   Kalki Koechlin Drama   Musical   Romance
son of sardaar,Ashwani Dhir,Ajay Devgn   Sanjay Dutt   Sonakshi Sinha   Juhi Chawla,Action   Comedy   Romance,Ashwani Dhir Ajay Devgn   Sanjay Dutt   Sonakshi Sinha   Juhi Chawla Action   Comedy   Romance
