title,directors,actors,genre,comb
luck by chance,Zoya Akhtar,Farhan Akhtar   Konkona Sen Sharma   Rishi Kapoor   Dimple Kapadia,Drama,Zoya Akhtar Farhan Akhtar   Konkona Sen Sharma   Rishi Kapoor   Dimple Kapadia Drama
kya love story hai,Lovely Singh,Tusshar Kapoor   Ayesha Takia   Karan Hukka   Rahul Singh,Comedy   Drama   Romance,Lovely Singh Tusshar Kapoor   Ayesha Takia   Karan Hukka   Rahul Singh Comedy   Drama   Romance
halla bol,Rajkumar Santoshi,Ajay Devgn   Vidya Balan   Pankaj Kapur   Darshan Jariwala,Action   Crime   Drama,Rajkumar Santoshi Ajay Devgn   Vidya Balan   Pankaj Kapur   Darshan Jariwala Action   Crime   Drama
detective naani,Romilla Mukherjee,Ava Mukherjee   Zain Khan   Simran Singh   Amrita Raichand,Crime   Drama   Family,Romilla Mukherjee Ava Mukherjee   Zain Khan   Simran Singh   Amrita Raichand Crime   Drama   Family
red: the dark side,Vikram Bhatt,Aftab Shivdasani   Celina Jaitly   Amrita Arora   Amin Hajee,Drama   Romance   Thriller,Vikram Bhatt Aftab Shivdasani   Celina Jaitly   Amrita Arora   Amin Hajee Drama   Romance   Thriller
raqeeb,Anurag Singh,Rahul Khanna   Sharman Joshi   Tanushree Dutta   Jimmy Shergill,Crime   Drama   Mystery,Anurag Singh Rahul Khanna   Sharman Joshi   Tanushree Dutta   Jimmy Shergill Crime   Drama   Mystery
manorama six feet under,Navdeep Singh,Abhay Deol   Gul Panag   Raima Sen   Sarika,Crime   Drama   Mystery,Navdeep Singh Abhay Deol   Gul Panag   Raima Sen   Sarika Crime   Drama   Mystery
99.9 fm,Sanjay Bhatia,Shawar Ali   Jaipreet Nagra   Raima Sen   Dipannita Sharma,Crime,Sanjay Bhatia Shawar Ali   Jaipreet Nagra   Raima Sen   Dipannita Sharma Crime
arjun devaa,Imran Khan,Mithun Chakraborty   Puru Rajkumar   Rutika Singh   Gajendra Chouhan,Action   Crime   Musical,Imran Khan Mithun Chakraborty   Puru Rajkumar   Rutika Singh   Gajendra Chouhan Action   Crime   Musical
fashion,Madhur Bhandarkar,Priyanka Chopra   Kangana Ranaut   Mugdha Godse   Arbaaz Khan,Drama   Romance,Madhur Bhandarkar Priyanka Chopra   Kangana Ranaut   Mugdha Godse   Arbaaz Khan Drama   Romance
cheeni kum,R. Balki,Amitabh Bachchan   Tabu   Paresh Rawal   Zohra Segal,Comedy   Romance,R. Balki Amitabh Bachchan   Tabu   Paresh Rawal   Zohra Segal Comedy   Romance
hattrick,Milan Luthria,Nana Patekar   Danny Denzongpa   Paresh Rawal   Kunal Kapoor,Comedy   Drama   Romance,Milan Luthria Nana Patekar   Danny Denzongpa   Paresh Rawal   Kunal Kapoor Comedy   Drama   Romance
gauri: the unborn,Aku Akbar,Mohan Azaad   Anupam Kher   Atul Kulkarni   Manasi,Drama   Horror   Thriller,Aku Akbar Mohan Azaad   Anupam Kher   Atul Kulkarni   Manasi Drama   Horror   Thriller
laaga chunari mein daag: journey of a woman,Pradeep Sarkar,Abhishek Bachchan   Rani Mukerji   Konkona Sen Sharma   Jaya Bhaduri,Drama,Pradeep Sarkar Abhishek Bachchan   Rani Mukerji   Konkona Sen Sharma   Jaya Bhaduri Drama
aaja nachle,Anil Mehta,Madhuri Dixit   Darshan Jariwala   Raghuvir Yadav   Divya Dutta,Drama   Musical,Anil Mehta Madhuri Dixit   Darshan Jariwala   Raghuvir Yadav   Divya Dutta Drama   Musical
taare zameen par,Aamir Khan   Amole Gupte,Darsheel Safary   Aamir Khan   Tanay Chheda   Sachet Engineer,Drama   Family,Aamir Khan   Amole Gupte Darsheel Safary   Aamir Khan   Tanay Chheda   Sachet Engineer Drama   Family
a flat,Hemant Madhukar,Jimmy Shergill   Sanjay Suri   Hazel Croney   Kaveri Jha,Drama   Horror   Romance,Hemant Madhukar Jimmy Shergill   Sanjay Suri   Hazel Croney   Kaveri Jha Drama   Horror   Romance
delhii heights,R. Anand Kumar,Jimmy Shergill   Neha Dhupia   Kamini Khanna   Madhavan,Drama   Romance,R. Anand Kumar Jimmy Shergill   Neha Dhupia   Kamini Khanna   Madhavan Drama   Romance
30 days,Ravi Sinha,Abhay Bhargav   Milind Gunaji   Dinesh Hingoo   Mushtaq Khan,Horror,Ravi Sinha Abhay Bhargav   Milind Gunaji   Dinesh Hingoo   Mushtaq Khan Horror
bhoothnath,Vivek Sharma,Amitabh Bachchan   Juhi Chawla   Satish Shah   Rajpal Yadav,Comedy   Drama   Fantasy,Vivek Sharma Amitabh Bachchan   Juhi Chawla   Satish Shah   Rajpal Yadav Comedy   Drama   Fantasy
bhool bhulaiyaa,Priyadarshan,Akshay Kumar   Vidya Balan   Ameesha Patel   Shiney Ahuja,Comedy   Horror   Mystery,Priyadarshan Akshay Kumar   Vidya Balan   Ameesha Patel   Shiney Ahuja Comedy   Horror   Mystery
dhol,Priyadarshan,Sharman Joshi   Tusshar Kapoor   Kunal Khemu   Rajpal Yadav,Comedy,Priyadarshan Sharman Joshi   Tusshar Kapoor   Kunal Khemu   Rajpal Yadav Comedy
ek chalis ki last local,Sanjay M. Khanduri,Abhay Deol   Neha Dhupia   Amit Mistry   Ashok Samarth,Adventure   Comedy   Crime,Sanjay M. Khanduri Abhay Deol   Neha Dhupia   Amit Mistry   Ashok Samarth Adventure   Comedy   Crime
no smoking,Anurag Kashyap,John Abraham   Ayesha Takia   Paresh Rawal   Ranvir Shorey,Drama   Thriller,Anurag Kashyap John Abraham   Ayesha Takia   Paresh Rawal   Ranvir Shorey Drama   Thriller
tashan,Vijay Krishna Acharya,Akshay Kumar   Saif Ali Khan   Kareena Kapoor   Anil Kapoor,Action   Comedy   Crime,Vijay Krishna Acharya Akshay Kumar   Saif Ali Khan   Kareena Kapoor   Anil Kapoor Action   Comedy   Crime
khoya khoya chand,Sudhir Mishra,Shiney Ahuja   Soha Ali Khan   Rajat Kapoor   Vinay Pathak,Drama   Romance,Sudhir Mishra Shiney Ahuja   Soha Ali Khan   Rajat Kapoor   Vinay Pathak Drama   Romance
the train: some lines shoulder never be crossed...,Hasnain Hyderabadwala   Raksha Mistry,Emraan Hashmi   Geeta Basra   Rajat Bedi   Anant Mahadevan,Thriller,Hasnain Hyderabadwala   Raksha Mistry Emraan Hashmi   Geeta Basra   Rajat Bedi   Anant Mahadevan Thriller
aap kaa surroor: the moviee - the real luv story,Prashant Chadha,Himesh Reshammiya   Hansika Motwani   Mallika Sherawat   Shravan Rathod,Drama   Romance   Thriller,Prashant Chadha Himesh Reshammiya   Hansika Motwani   Mallika Sherawat   Shravan Rathod Drama   Romance   Thriller
bheja fry,Sagar Ballary,Vinay Pathak   Rajat Kapoor   Sarika   Milind Soman,Comedy   Drama,Sagar Ballary Vinay Pathak   Rajat Kapoor   Sarika   Milind Soman Comedy   Drama
yehi hai zindagi,Ajay Phansekar   Raam Shetty,Parvin Dabas   Benjamin Gilani   Sahil Khan   Sheetal Kshirsagar,Action   Crime   Drama,Ajay Phansekar   Raam Shetty Parvin Dabas   Benjamin Gilani   Sahil Khan   Sheetal Kshirsagar Action   Crime   Drama
chain kulii ki main kulii,Kittu Saluja,Anand Abhyankar   Parimal Aloke   Chandan Anand   Bobby Bedi,Comedy   Drama   Family,Kittu Saluja Anand Abhyankar   Parimal Aloke   Chandan Anand   Bobby Bedi Comedy   Drama   Family
race,Abbas Alibhai Burmawalla   Mastan Alibhai Burmawalla,Saif Ali Khan   Akshaye Khanna   Bipasha Basu   Katrina Kaif,Action   Crime   Drama,Abbas Alibhai Burmawalla   Mastan Alibhai Burmawalla Saif Ali Khan   Akshaye Khanna   Bipasha Basu   Katrina Kaif Action   Crime   Drama
awarapan,Mohit Suri,Salil Acharya   Emraan Hashmi   J. Brandon Hill   Rehan Khan,Action   Crime   Drama,Mohit Suri Salil Acharya   Emraan Hashmi   J. Brandon Hill   Rehan Khan Action   Crime   Drama
naqaab,Abbas Alibhai Burmawalla   Mastan Alibhai Burmawalla,Bobby Deol   Akshaye Khanna   Urvashi Sharma   Vikas Kalantri,Crime   Drama   Romance,Abbas Alibhai Burmawalla   Mastan Alibhai Burmawalla Bobby Deol   Akshaye Khanna   Urvashi Sharma   Vikas Kalantri Crime   Drama   Romance
de taali,Eeshwar Nivas,Aftab Shivdasani   Ayesha Takia   Ritesh Deshmukh   Rimi Sen,Comedy   Drama   Romance,Eeshwar Nivas Aftab Shivdasani   Ayesha Takia   Ritesh Deshmukh   Rimi Sen Comedy   Drama   Romance
meerabai not out,Chandrakant Kulkarni,Anupam Kher   Mahesh Manjrekar   Mandira Bedi   Eijaz Khan,Comedy   Drama   Romance,Chandrakant Kulkarni Anupam Kher   Mahesh Manjrekar   Mandira Bedi   Eijaz Khan Comedy   Drama   Romance
om shanti om,Farah Khan,Shah Rukh Khan   Arjun Rampal   Kiron Kher   Shreyas Talpade,Action   Comedy   Drama,Farah Khan Shah Rukh Khan   Arjun Rampal   Kiron Kher   Shreyas Talpade Action   Comedy   Drama
krrish 3,Rakesh Roshan,Hrithik Roshan   Amitabh Bachchan   Priyanka Chopra   Naseeruddin Shah,Action   Sci-Fi,Rakesh Roshan Hrithik Roshan   Amitabh Bachchan   Priyanka Chopra   Naseeruddin Shah Action   Sci-Fi
kidnap,Sanjay Gadhvi,Sanjay Dutt   Imran Khan   Minissha Lamba   Vidya Malvade,Crime   Drama   Thriller,Sanjay Gadhvi Sanjay Dutt   Imran Khan   Minissha Lamba   Vidya Malvade Crime   Drama   Thriller
sunday,Rohit Shetty,Ajay Devgn   Ayesha Takia   Arshad Warsi   Irrfan Khan,Action   Comedy   Romance,Rohit Shetty Ajay Devgn   Ayesha Takia   Arshad Warsi   Irrfan Khan Action   Comedy   Romance
u me aur hum,Ajay Devgn,Ajay Devgn   Kajol   Sumeet Raghvan   Divya Dutta,Comedy   Drama   Romance,Ajay Devgn Ajay Devgn   Kajol   Sumeet Raghvan   Divya Dutta Comedy   Drama   Romance
delhi-6,Rakeysh Omprakash Mehra,Waheeda Rehman   Abhishek Bachchan   Sonam Kapoor   Rishi Kapoor,Comedy   Drama,Rakeysh Omprakash Mehra Waheeda Rehman   Abhishek Bachchan   Sonam Kapoor   Rishi Kapoor Comedy   Drama
woodstock villa,Hansal Mehta,Sikander Kher   Neha Uberoi   Arbaaz Khan   Gulshan Grover,Drama   Mystery   Thriller,Hansal Mehta Sikander Kher   Neha Uberoi   Arbaaz Khan   Gulshan Grover Drama   Mystery   Thriller
red swastik,Vinod Pande,Sherlyn Chopra   Udayyan Raathore   Zahid Ali   Amrita,Crime   Drama   Thriller,Vinod Pande Sherlyn Chopra   Udayyan Raathore   Zahid Ali   Amrita Crime   Drama   Thriller
roadside romeo,Jugal Hansraj,Saif Ali Khan   Kareena Kapoor   Javed Jaffrey   Vrajesh Hirjee,Animation   Comedy   Family,Jugal Hansraj Saif Ali Khan   Kareena Kapoor   Javed Jaffrey   Vrajesh Hirjee Animation   Comedy   Family
chanchal,Indrajit Singh,Armaan Shahabi   Gracy Singh,Drama   Musical,Indrajit Singh Armaan Shahabi   Gracy Singh Drama   Musical
drona,Goldie Behl,Jayshree Arora   Veer Arya   Abhishek Bachchan   Jaya Bhaduri,Action   Adventure   Drama,Goldie Behl Jayshree Arora   Veer Arya   Abhishek Bachchan   Jaya Bhaduri Action   Adventure   Drama
my friend ganesha,Rajiv S. Ruia,Arun Bakshi   Ahsaas Channa   Kiran Janjani   Mushtaq Khan,Animation,Rajiv S. Ruia Arun Bakshi   Ahsaas Channa   Kiran Janjani   Mushtaq Khan Animation
johnny gaddaar,Sriram Raghavan,Dharmendra   Rimi Sen   Ashwini Khalsekar   Neil Nitin Mukesh,Crime   Drama   Thriller,Sriram Raghavan Dharmendra   Rimi Sen   Ashwini Khalsekar   Neil Nitin Mukesh Crime   Drama   Thriller
hastey hastey follow your heart,Ramanjit Juneja   Tony,Jimmy Shergill   Rajpal Yadav   Shakti Kapoor   Ann Marie Seall,Comedy   Drama,Ramanjit Juneja   Tony Jimmy Shergill   Rajpal Yadav   Shakti Kapoor   Ann Marie Seall Comedy   Drama
buddha mar gaya,Rahul Rawail,Mona Ambegaonkar   Jitender Bhargava   Birbal   Heenaa Biswas,Comedy,Rahul Rawail Mona Ambegaonkar   Jitender Bhargava   Birbal   Heenaa Biswas Comedy
journey bombay to goa: laughter unlimited,Raj Pendurkar,Sunil Pal   Raju Srivastava   Vijay Raaz   Ehsaan Qureshi,Comedy,Raj Pendurkar Sunil Pal   Raju Srivastava   Vijay Raaz   Ehsaan Qureshi Comedy
wanted,Prabhudheva,Salman Khan   Ayesha Takia   Vinod Khanna   Mahesh Manjrekar,Action   Comedy   Crime,Prabhudheva Salman Khan   Ayesha Takia   Vinod Khanna   Mahesh Manjrekar Action   Comedy   Crime
hello,Atul Agnihotri,Bharati Achrekar   Amrita Arora   Sharman Joshi   Katrina Kaif,Drama   Romance,Atul Agnihotri Bharati Achrekar   Amrita Arora   Sharman Joshi   Katrina Kaif Drama   Romance
dhokha,Pooja Bhatt,Muzammil Ibrahim   Tulip Joshi   Aushima Sawhney   Bharat Dabholkar,Action   Drama   Romance,Pooja Bhatt Muzammil Ibrahim   Tulip Joshi   Aushima Sawhney   Bharat Dabholkar Action   Drama   Romance
chandni chowk to china,Nikhil Advani,Akshay Kumar   Deepika Padukone   Mithun Chakraborty   Ranvir Shorey,Action   Adventure   Comedy,Nikhil Advani Akshay Kumar   Deepika Padukone   Mithun Chakraborty   Ranvir Shorey Action   Adventure   Comedy
golmaal returns,Rohit Shetty,Amrita Arora   Leigh Barwell   Robin Bhatt   Ajay Devgn,Comedy   Crime   Drama,Rohit Shetty Amrita Arora   Leigh Barwell   Robin Bhatt   Ajay Devgn Comedy   Crime   Drama
jab we met,Imtiaz Ali,Shahid Kapoor   Kareena Kapoor   Tarun Arora   Dara Singh,Comedy   Romance,Imtiaz Ali Shahid Kapoor   Kareena Kapoor   Tarun Arora   Dara Singh Comedy   Romance
sab kuch hai kuch bhi nahin,Abhik Bhanu,Brian Dawson   Vikram Gokhale   Puja Gupta   A.K. Hangal,Drama,Abhik Bhanu Brian Dawson   Vikram Gokhale   Puja Gupta   A.K. Hangal Drama
victoria no. 203: diamonds are forever,Anant Mahadevan,Anupam Kher   Om Puri   Jimmy Shergill   Soniya Mehra,Comedy   Crime   Mystery,Anant Mahadevan Anupam Kher   Om Puri   Jimmy Shergill   Soniya Mehra Comedy   Crime   Mystery
dil dosti etc,Manish Tiwary,Imaaduddin Shah   Shreyas Talpade   Smriti Mishra   Nikita Anand,Comedy   Crime   Drama,Manish Tiwary Imaaduddin Shah   Shreyas Talpade   Smriti Mishra   Nikita Anand Comedy   Crime   Drama
shaurya: it takes courage to make right... right,Samar Khan,Rahul Bose   Javed Jaffrey   Minissha Lamba   Seema Biswas,Crime   Drama   Thriller,Samar Khan Rahul Bose   Javed Jaffrey   Minissha Lamba   Seema Biswas Crime   Drama   Thriller
8 x 10 tasveer,Nagesh Kukunoor,Akshay Kumar   Ayesha Takia   Javed Jaffrey   Girish Karnad,Crime   Drama   Mystery,Nagesh Kukunoor Akshay Kumar   Ayesha Takia   Javed Jaffrey   Girish Karnad Crime   Drama   Mystery
kismat konnection,Aziz Mirza,Shahid Kapoor   Vidya Balan   Vishal Malhotra   Om Puri,Comedy   Drama   Romance,Aziz Mirza Shahid Kapoor   Vidya Balan   Vishal Malhotra   Om Puri Comedy   Drama   Romance
yuvvraaj,Subhash Ghai,Salman Khan   Anil Kapoor   Zayed Khan   Mithun Chakraborty,Comedy   Drama   Romance,Subhash Ghai Salman Khan   Anil Kapoor   Zayed Khan   Mithun Chakraborty Comedy   Drama   Romance
heroes,Samir Karnik,Sohail Khan   Vatsal Seth   Amrita Arora   Riya Sen,Action   Adventure   Comedy,Samir Karnik Sohail Khan   Vatsal Seth   Amrita Arora   Riya Sen Action   Adventure   Comedy
bobby: love and lust,Rakesh Parmaar,Monalisa   Usha Bachani   Gaurav Dixit   Milind Gunaji,Romance,Rakesh Parmaar Monalisa   Usha Bachani   Gaurav Dixit   Milind Gunaji Romance
aseema: beyond boundaries,Sisir Misra,Gracy Singh   Asseem Merchant   Neha Pendse   Aryan Singh,Drama   Romance,Sisir Misra Gracy Singh   Asseem Merchant   Neha Pendse   Aryan Singh Drama   Romance
dhan dhana dhan goal,Vivek Agnihotri,John Abraham   Arshad Warsi   Bipasha Basu   Boman Irani,Sport,Vivek Agnihotri John Abraham   Arshad Warsi   Bipasha Basu   Boman Irani Sport
pankh,Sudipto Chattopadhyay,Bipasha Basu   Lillete Dubey   Mahesh Manjrekar   Ronit Roy,Drama,Sudipto Chattopadhyay Bipasha Basu   Lillete Dubey   Mahesh Manjrekar   Ronit Roy Drama
money hai toh honey hai,Ganesh Acharya,Govinda   Manoj Bajpayee   Aftab Shivdasani   Upen Patel,Comedy   Drama,Ganesh Acharya Govinda   Manoj Bajpayee   Aftab Shivdasani   Upen Patel Comedy   Drama
mumbai salsa,Manoj Tyagi,Linda Arsenio   Shaurya Chauhan   Alisha Chinoi   Vir Das,Comedy   Drama,Manoj Tyagi Linda Arsenio   Shaurya Chauhan   Alisha Chinoi   Vir Das Comedy   Drama
hijack,Kunal Shivdasani,Shiney Ahuja   Mona Ambegaonkar   Ishita Chauhan   Mukesh Chhabra,Action   Drama   Thriller,Kunal Shivdasani Shiney Ahuja   Mona Ambegaonkar   Ishita Chauhan   Mukesh Chhabra Action   Drama   Thriller
maan gaye mughall-e-azam,Sanjay Chhel,Mallika Sherawat   Rahul Bose   Paresh Rawal   Kay Kay Menon,Comedy   Crime   Drama,Sanjay Chhel Mallika Sherawat   Rahul Bose   Paresh Rawal   Kay Kay Menon Comedy   Crime   Drama
ugly aur pagli,Sachin Kamlakar Khot,Mallika Sherawat   Ranvir Shorey   Bharati Achrekar   Zeenat Aman,Comedy   Drama,Sachin Kamlakar Khot Mallika Sherawat   Ranvir Shorey   Bharati Achrekar   Zeenat Aman Comedy   Drama
aabra ka daabra,Dheeraj Kumar,Naveen Bawa   Satish Kaushik   Anupam Kher   Krrishna,Fantasy,Dheeraj Kumar Naveen Bawa   Satish Kaushik   Anupam Kher   Krrishna Fantasy
rama rama kya hai dramaaa,Chandrakant Singh,Neha Dhupia   Amrita Arora   Anupam Kher   Rati Agnihotri,Comedy   Drama   Romance,Chandrakant Singh Neha Dhupia   Amrita Arora   Anupam Kher   Rati Agnihotri Comedy   Drama   Romance
yeh hai pyar ka mausam,Rajesh Bakshi,Rajat Bakshi   Rajesh Bakshi   Prem Chabra   Harish Ghera,Crime,Rajesh Bakshi Rajat Bakshi   Rajesh Bakshi   Prem Chabra   Harish Ghera Crime
kambakkht ishq,Sabir Khan,Sylvester Stallone   Brandon Routh   Denise Richards   Whoopi Goldberg,Action   Comedy   Romance,Sabir Khan Sylvester Stallone   Brandon Routh   Denise Richards   Whoopi Goldberg Action   Comedy   Romance
singh is kinng,Anees Bazmee,Akshay Kumar   Katrina Kaif   Om Puri   Kiron Kher,Action   Comedy   Crime,Anees Bazmee Akshay Kumar   Katrina Kaif   Om Puri   Kiron Kher Action   Comedy   Crime
karzzzz,Satish Kaushik,Himesh Reshammiya   Urmila Matondkar   Shweta Kumar   Dino Morea,Action   Drama   Musical,Satish Kaushik Himesh Reshammiya   Urmila Matondkar   Shweta Kumar   Dino Morea Action   Drama   Musical
bombay to bangkok,Nagesh Kukunoor,Shreyas Talpade   Lena Christensen   Vijay Maurya   Manmeet Singh,Comedy   Drama   Romance,Nagesh Kukunoor Shreyas Talpade   Lena Christensen   Vijay Maurya   Manmeet Singh Comedy   Drama   Romance
ghajini,A.R. Murugadoss,Aamir Khan   Asin   Jiah Khan   Tinnu Anand,Action   Drama   Mystery,A.R. Murugadoss Aamir Khan   Asin   Jiah Khan   Tinnu Anand Action   Drama   Mystery
return of hanuman,Anurag Kashyap,unknown,Animation   Action   Adventure,Anurag Kashyap unknown Animation   Action   Adventure
c kkompany,Sachin Yardi,Tusshar Kapoor   Anupam Kher   Rajpal Yadav   Raima Sen,Comedy   Drama,Sachin Yardi Tusshar Kapoor   Anupam Kher   Rajpal Yadav   Raima Sen Comedy   Drama
mere baap pehle aap,Priyadarshan,Paresh Rawal   Akshaye Khanna   Genelia D'Souza   Om Puri,Comedy   Drama   Romance,Priyadarshan Paresh Rawal   Akshaye Khanna   Genelia D'Souza   Om Puri Comedy   Drama   Romance
victory,Ajit Pal Mangat,Harman Baweja   Allan Border   Mike Hussey   Simon Jones,Drama   Sport,Ajit Pal Mangat Harman Baweja   Allan Border   Mike Hussey   Simon Jones Drama   Sport
delhi safari,Nikhil Advani,Cary Elwes   Christopher Lloyd   Troy Baker   Tom Kenny,Animation,Nikhil Advani Cary Elwes   Christopher Lloyd   Troy Baker   Tom Kenny Animation
main aurr mrs khanna,Prem Soni,Kareena Kapoor   Salman Khan   Sohail Khan   Yash Tonk,Comedy   Drama,Prem Soni Kareena Kapoor   Salman Khan   Sohail Khan   Yash Tonk Comedy   Drama
zahreela,Raj N. Sippy,Vikas Anand   Asrani   Mithun Chakraborty   Gulshan Grover,Action,Raj N. Sippy Vikas Anand   Asrani   Mithun Chakraborty   Gulshan Grover Action
jai ganesh deva,K. Shankar,Delhi Ganesh   Jai Ganesh   Nizhalgal Ravi   Radha Ravi,Fantasy,K. Shankar Delhi Ganesh   Jai Ganesh   Nizhalgal Ravi   Radha Ravi Fantasy
quick gun murugun: misadventures of an indian cowboy,Shashanka Ghosh,Rajendraprasad   Nasser   Rambha   Raju Sundaram,Action   Comedy   Drama,Shashanka Ghosh Rajendraprasad   Nasser   Rambha   Raju Sundaram Action   Comedy   Drama
one two three,Ashwani Dhir,Neetu Chandra   Esha Deol   Vrajesh Hirjee   Tusshar Kapoor,Action   Comedy   Drama,Ashwani Dhir Neetu Chandra   Esha Deol   Vrajesh Hirjee   Tusshar Kapoor Action   Comedy   Drama
paying guests,Paritosh Painter,Shreyas Talpade   Javed Jaffrey   Aashish Chaudhary   Vatsal Seth,Comedy   Drama,Paritosh Painter Shreyas Talpade   Javed Jaffrey   Aashish Chaudhary   Vatsal Seth Comedy   Drama
superstar,Rohit Jugraj,Kunal Khemu   Tulip Joshi   Aushima Sawhney   Apoorva S. Badgaiyan,Drama   Romance,Rohit Jugraj Kunal Khemu   Tulip Joshi   Aushima Sawhney   Apoorva S. Badgaiyan Drama   Romance
mission istaanbul: darr ke aagey jeet hai!,Apoorva Lakhia,Vivek Oberoi   Zayed Khan   Shriya Saran   Shabbir Ahluwalia,Action   Adventure   Drama,Apoorva Lakhia Vivek Oberoi   Zayed Khan   Shriya Saran   Shabbir Ahluwalia Action   Adventure   Drama
mithya,Rajat Kapoor,Ranvir Shorey   Neha Dhupia   Naseeruddin Shah   Saurabh Shukla,Comedy   Crime   Drama,Rajat Kapoor Ranvir Shorey   Neha Dhupia   Naseeruddin Shah   Saurabh Shukla Comedy   Crime   Drama
dulha mil gaya,Mudassar Aziz,Sushmita Sen   Fardeen Khan   Ishita Sharma   Shah Rukh Khan,Comedy   Drama,Mudassar Aziz Sushmita Sen   Fardeen Khan   Ishita Sharma   Shah Rukh Khan Comedy   Drama
krazzy 4,Jaideep Sen,Juhi Chawla   Irrfan Khan   Arshad Warsi   Rajpal Yadav,Action   Comedy   Crime,Jaideep Sen Juhi Chawla   Irrfan Khan   Arshad Warsi   Rajpal Yadav Action   Comedy   Crime
rab ne bana di jodi,Aditya Chopra,Shah Rukh Khan   Vinay Pathak   Anushka Sharma   M.K. Raina,Comedy   Drama   Musical,Aditya Chopra Shah Rukh Khan   Vinay Pathak   Anushka Sharma   M.K. Raina Comedy   Drama   Musical
bachna ae haseeno,Siddharth Anand,Ranbir Kapoor   Bipasha Basu   Minissha Lamba   Deepika Padukone,Comedy   Drama   Romance,Siddharth Anand Ranbir Kapoor   Bipasha Basu   Minissha Lamba   Deepika Padukone Comedy   Drama   Romance
teen patti,Leena Yadav,Amitabh Bachchan   Madhavan   Shraddha Kapoor   Siddharth Kher,Drama   Thriller,Leena Yadav Amitabh Bachchan   Madhavan   Shraddha Kapoor   Siddharth Kher Drama   Thriller
sadiyaan: boundaries divide... love unites,Raj Kanwar,Rekha   Hema Malini   Javed Sheikh   Avtar Gill,Drama   Romance,Raj Kanwar Rekha   Hema Malini   Javed Sheikh   Avtar Gill Drama   Romance
the stoneman murders,Manish Gupta,Kay Kay Menon   Arbaaz Khan   Rukhsar   Veerendra Saxena,Crime   Drama   Mystery,Manish Gupta Kay Kay Menon   Arbaaz Khan   Rukhsar   Veerendra Saxena Crime   Drama   Mystery
veer,Anil Sharma,Salman Khan   Mithun Chakraborty   Jackie Shroff   Sohail Khan,Action   Adventure   Drama,Anil Sharma Salman Khan   Mithun Chakraborty   Jackie Shroff   Sohail Khan Action   Adventure   Drama
dostana,Tarun Mansukhani,Abhishek Bachchan   John Abraham   Priyanka Chopra   Kiron Kher,Comedy   Drama   Romance,Tarun Mansukhani Abhishek Bachchan   John Abraham   Priyanka Chopra   Kiron Kher Comedy   Drama   Romance
kurbaan,Renzil D'Silva,Kareena Kapoor   Saif Ali Khan   Om Puri   Vivek Oberoi,Action   Crime   Drama,Renzil D'Silva Kareena Kapoor   Saif Ali Khan   Om Puri   Vivek Oberoi Action   Crime   Drama
3 idiots,Rajkumar Hirani,Aamir Khan   Kareena Kapoor   Madhavan   Sharman Joshi,Comedy   Drama,Rajkumar Hirani Aamir Khan   Kareena Kapoor   Madhavan   Sharman Joshi Comedy   Drama
jai ho,Sohail Khan,Salman Khan   Tabu   Sunil Shetty   Genelia D'Souza,Action   Drama,Sohail Khan Salman Khan   Tabu   Sunil Shetty   Genelia D'Souza Action   Drama
my name is khan,Karan Johar,Shah Rukh Khan   Kajol   Katie A. Keane   Kenton Duty,Drama   Romance   Thriller,Karan Johar Shah Rukh Khan   Kajol   Katie A. Keane   Kenton Duty Drama   Romance   Thriller
toonpur ka superrhero,Kireet Khurana,Ajay Devgn   Sanjay Dutt   Delnaaz Irani   Chinky Jaiswal,Animation   Action   Adventure,Kireet Khurana Ajay Devgn   Sanjay Dutt   Delnaaz Irani   Chinky Jaiswal Animation   Action   Adventure
hello darling,Manoj Tiwari,Gul Panag   Celina Jaitly   Isha Koppikar   Chunky Pandey,Comedy   Drama,Manoj Tiwari Gul Panag   Celina Jaitly   Isha Koppikar   Chunky Pandey Comedy   Drama
thoda pyaar thoda magic,Kunal Kohli,Rishi Kapoor   Saif Ali Khan   Rani Mukerji   Akshat Chopra,Comedy   Drama   Family,Kunal Kohli Rishi Kapoor   Saif Ali Khan   Rani Mukerji   Akshat Chopra Comedy   Drama   Family
jaane kahan se aayi hai,Milap Zaveri,Priyanka Chopra   Akshay Kumar   Jacqueline Fernandez   Karan Johar,Comedy   Drama   Fantasy,Milap Zaveri Priyanka Chopra   Akshay Kumar   Jacqueline Fernandez   Karan Johar Comedy   Drama   Fantasy
get educated: paathshaala,Milind Ukey,Nana Patekar   Shahid Kapoor   Ayesha Takia   Sushant Singh,Drama,Milind Ukey Nana Patekar   Shahid Kapoor   Ayesha Takia   Sushant Singh Drama
ek vivaah... aisa bhi,Kaushik Ghatak,Isha Koppikar   Sonu Sood   Anand Abhyankar   Daman Baggan,Drama   Romance,Kaushik Ghatak Isha Koppikar   Sonu Sood   Anand Abhyankar   Daman Baggan Drama   Romance
kites,Anurag Basu,Hrithik Roshan   Brbara Mori   Steven Michael Quezada   Kangana Ranaut,Action   Drama   Romance,Anurag Basu Hrithik Roshan   Brbara Mori   Steven Michael Quezada   Kangana Ranaut Action   Drama   Romance
bad luck govind,Varun Khanna,Gaurav Kapoor   Hrishitaa Bhatt   Govind Namdeo   Zakir Hussain,Comedy   Crime   Drama,Varun Khanna Gaurav Kapoor   Hrishitaa Bhatt   Govind Namdeo   Zakir Hussain Comedy   Crime   Drama
tulsi: mathrudevobhava,Ajay Kumar,Manisha Koirala   Irrfan Khan   Sadashiv Amrapurkar   Tinnu Anand,Drama,Ajay Kumar Manisha Koirala   Irrfan Khan   Sadashiv Amrapurkar   Tinnu Anand Drama
acid factory,Suparn Verma,Fardeen Khan   Dia Mirza   Manoj Bajpayee   Aftab Shivdasani,Action   Crime   Drama,Suparn Verma Fardeen Khan   Dia Mirza   Manoj Bajpayee   Aftab Shivdasani Action   Crime   Drama
ab... bas!,Rajesh Kumar Singh,Chetanya Adeep   Shawar Ali   Arun Bakshi   Chitrapama,Thriller,Rajesh Kumar Singh Chetanya Adeep   Shawar Ali   Arun Bakshi   Chitrapama Thriller
barah aana,Raja Menon,Naseeruddin Shah   Vijay Raaz   Arjun Mathur   Violante Placido,Comedy   Crime   Drama,Raja Menon Naseeruddin Shah   Vijay Raaz   Arjun Mathur   Violante Placido Comedy   Crime   Drama
dil bole hadippa!,Anurag Singh,Shahid Kapoor   Rani Mukerji   Anupam Kher   Dalip Tahil,Comedy   Drama   Sport,Anurag Singh Shahid Kapoor   Rani Mukerji   Anupam Kher   Dalip Tahil Comedy   Drama   Sport
bhram: an illusion,Pavan Kaul,Dino Morea   Milind Soman   Sheetal Menon   Simone Singh,Drama   Mystery   Romance,Pavan Kaul Dino Morea   Milind Soman   Sheetal Menon   Simone Singh Drama   Mystery   Romance
26th july at barista,Mohan Sharma,Ajita   Himani Chawla   Sumeet Chawla   Suresh Dubey,Drama,Mohan Sharma Ajita   Himani Chawla   Sumeet Chawla   Suresh Dubey Drama
jannat: in search of heaven...,Kunal Deshmukh,Emraan Hashmi   Sonal Chauhan   Shakeel Khan   Sameer Kochhar,Crime   Drama   Romance,Kunal Deshmukh Emraan Hashmi   Sonal Chauhan   Shakeel Khan   Sameer Kochhar Crime   Drama   Romance
yaar meri zindagi,Ashok Gupta   Mukul Dutt,Amitabh Bachchan   Shatrughan Sinha   Sharda   Sudha Chandran,Drama   Family   Musical,Ashok Gupta   Mukul Dutt Amitabh Bachchan   Shatrughan Sinha   Sharda   Sudha Chandran Drama   Family   Musical
