title,directors,actors,genre,comb
rang de basanti,Rakeysh Omprakash Mehra,Aamir Khan   Siddharth   Sharman Joshi   Kunal Kapoor,Drama,Rakeysh Omprakash Mehra Aamir Khan   Siddharth   Sharman Joshi   Kunal Kapoor Drama
masti,Indra Kumar,Aftab Shivdasani   Vivek Oberoi   Ritesh Deshmukh   Amrita Rao,Comedy   Crime   Mystery,Indra Kumar Aftab Shivdasani   Vivek Oberoi   Ritesh Deshmukh   Amrita Rao Comedy   Crime   Mystery
hawas,Karan Razdan,Shawar Ali   Tarun Arora   Madina   Meghna Naidu,Drama   Romance   Thriller,Karan Razdan Shawar Ali   Tarun Arora   Madina   Meghna Naidu Drama   Romance   Thriller
krishna cottage,Santram Varma,Sohail Khan   Isha Koppikar   Anita Hassandani   Rati Agnihotri,Comedy   Fantasy   Horror,Santram Varma Sohail Khan   Isha Koppikar   Anita Hassandani   Rati Agnihotri Comedy   Fantasy   Horror
muskaan,Rohit Manash   Rohit Nayyar   Manish Robin   Manish Sharma,Aftab Shivdasani   Gracy Singh   Parvin Dabas   Gulshan Grover,Romance,Rohit Manash   Rohit Nayyar   Manish Robin   Manish Sharma Aftab Shivdasani   Gracy Singh   Parvin Dabas   Gulshan Grover Romance
shabd,Leena Yadav,Sanjay Dutt   Aishwarya Rai Bachchan   Zayed Khan   Aakash Pandey,Drama,Leena Yadav Sanjay Dutt   Aishwarya Rai Bachchan   Zayed Khan   Aakash Pandey Drama
bardaasht,Eeshwar Nivas,Bobby Deol   Lara Dutta   Rahul Dev   Ritesh Deshmukh,Drama,Eeshwar Nivas Bobby Deol   Lara Dutta   Rahul Dev   Ritesh Deshmukh Drama
shart: the challenge,Puri Jagannadh,Amrita Arora   Asrani   Snehal Dabi   Vrajesh Hirjee,Romance,Puri Jagannadh Amrita Arora   Asrani   Snehal Dabi   Vrajesh Hirjee Romance
run,Jeeva,Abhishek Bachchan   Bhoomika Chawla   Mahesh Manjrekar   Vijay Raaz,Action   Comedy   Romance,Jeeva Abhishek Bachchan   Bhoomika Chawla   Mahesh Manjrekar   Vijay Raaz Action   Comedy   Romance
gayab,Prawal Raman,Rasika Joshi   Tusshar Kapoor   Ikhlaq Khan   Antara Mali,Fantasy,Prawal Raman Rasika Joshi   Tusshar Kapoor   Ikhlaq Khan   Antara Mali Fantasy
shaadi ka laddoo,Raj Kaushal,Sanjay Suri   Mandira Bedi   Aashish Chaudhary   Divya Dutta,Comedy,Raj Kaushal Sanjay Suri   Mandira Bedi   Aashish Chaudhary   Divya Dutta Comedy
amu,Shonali Bose,Konkona Sen Sharma   Yashpal Sharma   Brinda Karat   Ankur Khanna,Drama,Shonali Bose Konkona Sen Sharma   Yashpal Sharma   Brinda Karat   Ankur Khanna Drama
girlfriend,Karan Razdan,Amrita Arora   Shantanu Chappana   Aashish Chaudhary   Isha Koppikar,Drama,Karan Razdan Amrita Arora   Shantanu Chappana   Aashish Chaudhary   Isha Koppikar Drama
garv: pride and honour,Puneet Issar,Salman Khan   Shilpa Shetty   Arbaaz Khan   Farida Jalal,Action   Drama,Puneet Issar Salman Khan   Shilpa Shetty   Arbaaz Khan   Farida Jalal Action   Drama
woh,Raj N. Sippy,Priyanshu Chatterjee   Cleo Isaacs   Kasam   Ayub Khan,Crime   Drama   Thriller,Raj N. Sippy Priyanshu Chatterjee   Cleo Isaacs   Kasam   Ayub Khan Crime   Drama   Thriller
dus,Anubhav Sinha,Sanjay Dutt   Sunil Shetty   Abhishek Bachchan   Zayed Khan,Action   Crime   Thriller,Anubhav Sinha Sanjay Dutt   Sunil Shetty   Abhishek Bachchan   Zayed Khan Action   Crime   Thriller
kaal,Soham Shah,Ajay Devgn   Vivek Oberoi   John Abraham   Lara Dutta,Thriller   Adventure   Mystery,Soham Shah Ajay Devgn   Vivek Oberoi   John Abraham   Lara Dutta Thriller   Adventure   Mystery
police force: an inside story,Dilip Shukla,Akshay Kumar   Raveena Tandon   Amrish Puri   Mohan Joshi,Action   Crime   Drama,Dilip Shukla Akshay Kumar   Raveena Tandon   Amrish Puri   Mohan Joshi Action   Crime   Drama
vaastu shastra,Saurab Narang,Vicky Ahuja   J.D. Chakravarthi   Ahsaas Channa   Peeya Rai Chowdhary,Horror   Mystery,Saurab Narang Vicky Ahuja   J.D. Chakravarthi   Ahsaas Channa   Peeya Rai Chowdhary Horror   Mystery
elaan,Vikram Bhatt,Arjun Rampal   Ameesha Patel   John Abraham   Lara Dutta,Action,Vikram Bhatt Arjun Rampal   Ameesha Patel   John Abraham   Lara Dutta Action
rakht,Mahesh Manjrekar,Sanjay Dutt   Sunil Shetty   Bipasha Basu   Dino Morea,Horror   Thriller,Mahesh Manjrekar Sanjay Dutt   Sunil Shetty   Bipasha Basu   Dino Morea Horror   Thriller
mujhse shaadi karogi,David Dhawan,Salman Khan   Akshay Kumar   Priyanka Chopra   Amrish Puri,Comedy   Romance,David Dhawan Salman Khan   Akshay Kumar   Priyanka Chopra   Amrish Puri Comedy   Romance
aitraaz,Abbas Alibhai Burmawalla   Mastan Alibhai Burmawalla,Akshay Kumar   Kareena Kapoor   Priyanka Chopra   Amrish Puri,Drama   Thriller,Abbas Alibhai Burmawalla   Mastan Alibhai Burmawalla Akshay Kumar   Kareena Kapoor   Priyanka Chopra   Amrish Puri Drama   Thriller
"chot [aaj isko, kal tereko]",Nabh Kumar 'Raju',Ashutosh Rana   Sharad S. Kapoor   Nethra Raghuraman   Ganesh Yadav,Musical   Action   Crime,Nabh Kumar 'Raju' Ashutosh Rana   Sharad S. Kapoor   Nethra Raghuraman   Ganesh Yadav Musical   Action   Crime
mere jeevan saathi,Suneel Darshan,Akshay Kumar   Karisma Kapoor   Ameesha Patel   Gulshan Grover,Music   Romance,Suneel Darshan Akshay Kumar   Karisma Kapoor   Ameesha Patel   Gulshan Grover Music   Romance
phir hera pheri,Neeraj Vora,Akshay Kumar   Sunil Shetty   Paresh Rawal   Bipasha Basu,Comedy   Crime,Neeraj Vora Akshay Kumar   Sunil Shetty   Paresh Rawal   Bipasha Basu Comedy   Crime
baabul,Ravi Chopra,Amitabh Bachchan   Salman Khan   Hema Malini   John Abraham,Drama   Family   Romance,Ravi Chopra Amitabh Bachchan   Salman Khan   Hema Malini   John Abraham Drama   Family   Romance
hyderabad blues 2,Nagesh Kukunoor,Tisca Chopra   Jyoti Dogra   Anuj Gurwara   Elahe Hiptoola,Drama   Comedy,Nagesh Kukunoor Tisca Chopra   Jyoti Dogra   Anuj Gurwara   Elahe Hiptoola Drama   Comedy
morning raga,Mahesh Dattani,Shabana Azmi   Prakash Rao   Lillete Dubey   Perizaad Zorabian,Drama,Mahesh Dattani Shabana Azmi   Prakash Rao   Lillete Dubey   Perizaad Zorabian Drama
revati,Farogh Siddique,Kashmira Shah   Kiran Kumar   Ayub Khan   Javed Khan,Drama,Farogh Siddique Kashmira Shah   Kiran Kumar   Ayub Khan   Javed Khan Drama
viruddh... family comes first,Mahesh Manjrekar,Amitabh Bachchan   Sharmila Tagore   John Abraham   Sanjay Dutt,Drama,Mahesh Manjrekar Amitabh Bachchan   Sharmila Tagore   John Abraham   Sanjay Dutt Drama
veer-zaara,Yash Chopra,Shah Rukh Khan   Preity Zinta   Rani Mukerji   Kiron Kher,Drama   Musical   Romance,Yash Chopra Shah Rukh Khan   Preity Zinta   Rani Mukerji   Kiron Kher Drama   Musical   Romance
julie,Deepak S. Shivdasani,Neha Dhupia   Priyanshu Chatterjee   Yash Tonk   Sanjay Kapoor,Drama,Deepak S. Shivdasani Neha Dhupia   Priyanshu Chatterjee   Yash Tonk   Sanjay Kapoor Drama
dhoom,Sanjay Gadhvi,Abhishek Bachchan   Uday Chopra   John Abraham   Esha Deol,Action   Adventure   Thriller,Sanjay Gadhvi Abhishek Bachchan   Uday Chopra   John Abraham   Esha Deol Action   Adventure   Thriller
fida,Ken Ghosh,Kareena Kapoor   Fardeen Khan   Shahid Kapoor   Kim Sharma,Adventure   Romance   Thriller,Ken Ghosh Kareena Kapoor   Fardeen Khan   Shahid Kapoor   Kim Sharma Adventure   Romance   Thriller
phir milenge,Revathy,Salman Khan   Abhishek Bachchan   Shilpa Shetty   Mita Vasisht,Drama,Revathy Salman Khan   Abhishek Bachchan   Shilpa Shetty   Mita Vasisht Drama
rok sako to rok lo,Arindam Chowdhuri,Sunny Deol   Yash Pandit   Manjari Phadnis   Carran Kapur,Adventure   Musical   Romance,Arindam Chowdhuri Sunny Deol   Yash Pandit   Manjari Phadnis   Carran Kapur Adventure   Musical   Romance
lakeer - forbidden lines,Ahmed Khan,Sunny Deol   Sunil Shetty   Sohail Khan   John Abraham,Action   Drama   Romance,Ahmed Khan Sunny Deol   Sunil Shetty   Sohail Khan   John Abraham Action   Drama   Romance
aakhri inteqam,Rajesh Bakshi,Sudesh Berry   Anu Kashyap   Amit Pachori   Jitender,Action,Rajesh Bakshi Sudesh Berry   Anu Kashyap   Amit Pachori   Jitender Action
tauba tauba,unknown,Laxmikant Berde   Bobby Darling   Amin Gazi   Ayub Khan,Comedy   Drama,unknown Laxmikant Berde   Bobby Darling   Amin Gazi   Ayub Khan Comedy   Drama
dobara,Shashi Ranjan,Jackie Shroff   Raveena Tandon   Mahima Chaudhry   Gulshan Grover,Musical   Drama,Shashi Ranjan Jackie Shroff   Raveena Tandon   Mahima Chaudhry   Gulshan Grover Musical   Drama
madhoshi,Tanveer Khan,Bipasha Basu   John Abraham   Priyanshu Chatterjee   Prakash Bhardwaj,Musical   Mystery   Drama,Tanveer Khan Bipasha Basu   John Abraham   Priyanshu Chatterjee   Prakash Bhardwaj Musical   Mystery   Drama
musafir,Sanjay Gupta,Anil Kapoor   Sameera Reddy   Aditya Pancholi   Mahesh Manjrekar,Action   Crime   Drama,Sanjay Gupta Anil Kapoor   Sameera Reddy   Aditya Pancholi   Mahesh Manjrekar Action   Crime   Drama
popcorn khao! mast ho jao,Kabir Sadanand,Akshay Kapoor   Tanisha   Yash Tonk   Deepak Tijori,Comedy   Drama   Romance,Kabir Sadanand Akshay Kapoor   Tanisha   Yash Tonk   Deepak Tijori Comedy   Drama   Romance
shaadi karke phas gaya yaar,K.S. Adiyaman,Salman Khan   Shilpa Shetty   Reema Lagoo   Mohnish Bahl,Romance,K.S. Adiyaman Salman Khan   Shilpa Shetty   Reema Lagoo   Mohnish Bahl Romance
tumsa nahin dekha,Anurag Basu,Emraan Hashmi   Dia Mirza   Anupam Kher   Sharat Saxena,Musical   Romance,Anurag Basu Emraan Hashmi   Dia Mirza   Anupam Kher   Sharat Saxena Musical   Romance
sarkar,Ram Gopal Varma,Amitabh Bachchan   Abhishek Bachchan   Kay Kay Menon   Supriya Pathak,Action   Crime   Drama,Ram Gopal Varma Amitabh Bachchan   Abhishek Bachchan   Kay Kay Menon   Supriya Pathak Action   Crime   Drama
ak 47,Raam Shetty,Audhitya Singh   Sheetal Bavishi   Om Puri   Ashish Vidyarthi,Action   Thriller,Raam Shetty Audhitya Singh   Sheetal Bavishi   Om Puri   Ashish Vidyarthi Action   Thriller
hatya: the murder,Kader Kashmiri,Akshay Kumar   Varsha Usgaonkar   Navin Nischol   Reema Lagoo,Action   Crime   Fantasy,Kader Kashmiri Akshay Kumar   Varsha Usgaonkar   Navin Nischol   Reema Lagoo Action   Crime   Fantasy
krrish,Rakesh Roshan,Rekha   Hrithik Roshan   Priyanka Chopra   Sharat Saxena,Action   Adventure   Romance,Rakesh Roshan Rekha   Hrithik Roshan   Priyanka Chopra   Sharat Saxena Action   Adventure   Romance
naach,Ram Gopal Varma,Antara Mali   Abhishek Bachchan   Ritesh Deshmukh   Priya Badlani,Musical   Drama,Ram Gopal Varma Antara Mali   Abhishek Bachchan   Ritesh Deshmukh   Priya Badlani Musical   Drama
padmashree laloo prasad yadav,Mahesh Manjrekar,Sunil Shetty   Masumeh Makhija   Mahesh Manjrekar   Johnny Lever,Comedy,Mahesh Manjrekar Sunil Shetty   Masumeh Makhija   Mahesh Manjrekar   Johnny Lever Comedy
shukriya: till death do us apart,Anupam Sinha,Anupam Kher   Aftab Shivdasani   Shriya Saran   Indraneel,Musical   Drama   Family,Anupam Sinha Anupam Kher   Aftab Shivdasani   Shriya Saran   Indraneel Musical   Drama   Family
taarzan: the wonder car,Abbas Alibhai Burmawalla   Mastan Alibhai Burmawalla,Vatsal Seth   Ayesha Takia   Ajay Devgn   Farida Jalal,Musical   Action   Drama,Abbas Alibhai Burmawalla   Mastan Alibhai Burmawalla Vatsal Seth   Ayesha Takia   Ajay Devgn   Farida Jalal Musical   Action   Drama
jo bole so nihaal,Rahul Rawail,Sunny Deol   Thomas Tevana   Gary Castro Churchwell   Kamaal Khan,Action,Rahul Rawail Sunny Deol   Thomas Tevana   Gary Castro Churchwell   Kamaal Khan Action
family: ties of blood,Rajkumar Santoshi,Amitabh Bachchan   Akshay Kumar   Bhoomika Chawla   Aryeman Ramsay,Action   Crime   Drama,Rajkumar Santoshi Amitabh Bachchan   Akshay Kumar   Bhoomika Chawla   Aryeman Ramsay Action   Crime   Drama
hulchul,Priyadarshan,Akshaye Khanna   Kareena Kapoor   Sunil Shetty   Paresh Rawal,Action   Comedy   Drama,Priyadarshan Akshaye Khanna   Kareena Kapoor   Sunil Shetty   Paresh Rawal Action   Comedy   Drama
khamoshh... khauff ki raat,Deepak Tijori,Shilpa Shetty   Juhi Chawla   Rajiv Singh   Shawar Ali,Thriller,Deepak Tijori Shilpa Shetty   Juhi Chawla   Rajiv Singh   Shawar Ali Thriller
parineeta,Pradeep Sarkar,Saif Ali Khan   Vidya Balan   Sanjay Dutt   Dia Mirza,Drama   Musical   Romance,Pradeep Sarkar Saif Ali Khan   Vidya Balan   Sanjay Dutt   Dia Mirza Drama   Musical   Romance
let's enjoy,Siddharth Anand Kumar   Ankur Tewari,Shomendra Bose   Aashish Chaudhary   Roshni Chopra   Arzoo Govitrikar,Comedy,Siddharth Anand Kumar   Ankur Tewari Shomendra Bose   Aashish Chaudhary   Roshni Chopra   Arzoo Govitrikar Comedy
insan,K. Subhash,Akshay Kumar   Ajay Devgn   Tusshar Kapoor   Esha Deol,Drama   War,K. Subhash Akshay Kumar   Ajay Devgn   Tusshar Kapoor   Esha Deol Drama   War
kisse pyaar karo?n,Ajay Chandhok,Arshad Warsi   Aashish Chaudhary   Yash Tonk   Udita Goswami,Action   Comedy   Crime,Ajay Chandhok Arshad Warsi   Aashish Chaudhary   Yash Tonk   Udita Goswami Action   Comedy   Crime
silsiilay,Khalid Mohamed,Tabu   Bhoomika Chawla   Riya Sen   Celina Jaitly,Drama,Khalid Mohamed Tabu   Bhoomika Chawla   Riya Sen   Celina Jaitly Drama
fanaa,Kunal Kohli,Aamir Khan   Kajol   Rishi Kapoor   Tabu,Drama   Musical   Romance,Kunal Kohli Aamir Khan   Kajol   Rishi Kapoor   Tabu Drama   Musical   Romance
pyaar mein twist,Hriday Shetty,Rishi Kapoor   Dimple Kapadia   Vikas Bhalla   Emma Bunton,Comedy   Drama   Musical,Hriday Shetty Rishi Kapoor   Dimple Kapadia   Vikas Bhalla   Emma Bunton Comedy   Drama   Musical
wajahh: a reason to kill,Gautam Adhikari,Arbaaz Khan   Gracy Singh   Shamita Shetty   Zulfi Sayed,Thriller,Gautam Adhikari Arbaaz Khan   Gracy Singh   Shamita Shetty   Zulfi Sayed Thriller
dhoom:2,Sanjay Gadhvi,Abhishek Bachchan   Uday Chopra   Hrithik Roshan   Aishwarya Rai Bachchan,Action   Thriller,Sanjay Gadhvi Abhishek Bachchan   Uday Chopra   Hrithik Roshan   Aishwarya Rai Bachchan Action   Thriller
mulaqaat,K. Ravi Shankar,Vinay Anand   Arun Bakshi   Rita Bhaduri   Milind Gunaji,Drama   Thriller,K. Ravi Shankar Vinay Anand   Arun Bakshi   Rita Bhaduri   Milind Gunaji Drama   Thriller
dil jo bhi kahey...,Romesh Sharma,Amitabh Bachchan   Revathy   Karan Sharma   Annabelle Wallis,Romance,Romesh Sharma Amitabh Bachchan   Revathy   Karan Sharma   Annabelle Wallis Romance
kis kis ki kismat,Govind Menon,Mallika Sherawat   Rati Agnihotri   Kurush Deboo   Tinnu Anand,Comedy,Govind Menon Mallika Sherawat   Rati Agnihotri   Kurush Deboo   Tinnu Anand Comedy
vaada,Satish Kaushik,Arjun Rampal   Zayed Khan   Ameesha Patel   Alok Nath,Romance   Mystery   Drama,Satish Kaushik Arjun Rampal   Zayed Khan   Ameesha Patel   Alok Nath Romance   Mystery   Drama
rog,Himanshu Brahmbhatt,Irrfan Khan   Suhel Seth   Himanshu Malik   Shyamoli Varma,Mystery   Romance   Thriller,Himanshu Brahmbhatt Irrfan Khan   Suhel Seth   Himanshu Malik   Shyamoli Varma Mystery   Romance   Thriller
milenge milenge,Satish Kaushik,Kareena Kapoor   Shahid Kapoor   Aarti Chhabria   Delnaaz Irani,Drama   Romance,Satish Kaushik Kareena Kapoor   Shahid Kapoor   Aarti Chhabria   Delnaaz Irani Drama   Romance
naina,Shripal Morakhia,Urmila Matondkar   Anuj Sawhney   Malavikka   Amardeep Jha,Drama   Horror   Mystery,Shripal Morakhia Urmila Matondkar   Anuj Sawhney   Malavikka   Amardeep Jha Drama   Horror   Mystery
page 3,Madhur Bhandarkar,Konkona Sen Sharma   Atul Kulkarni   Sandhya Mridul   Tara Sharma,Drama,Madhur Bhandarkar Konkona Sen Sharma   Atul Kulkarni   Sandhya Mridul   Tara Sharma Drama
a sublime love story: barsaat,Suneel Darshan,Bobby Deol   Bipasha Basu   Priyanka Chopra   Gajendra Chouhan,Romance,Suneel Darshan Bobby Deol   Bipasha Basu   Priyanka Chopra   Gajendra Chouhan Romance
blackmail,Anil Devgan,Ajay Devgn   Sunil Shetty   Priyanka Chopra   Dia Mirza,Action   Drama   Thriller,Anil Devgan Ajay Devgn   Sunil Shetty   Priyanka Chopra   Dia Mirza Action   Drama   Thriller
deewane huye paagal,Vikram Bhatt,Akshay Kumar   Sunil Shetty   Shahid Kapoor   Rimi Sen,Comedy   Romance,Vikram Bhatt Akshay Kumar   Sunil Shetty   Shahid Kapoor   Rimi Sen Comedy   Romance
fareb,Deepak Tijori,Shilpa Shetty   Manoj Bajpayee   Shamita Shetty   Parmeet Sethi,Drama   Thriller,Deepak Tijori Shilpa Shetty   Manoj Bajpayee   Shamita Shetty   Parmeet Sethi Drama   Thriller
humko deewana kar gaye,Raj Kanwar,Akshay Kumar   Katrina Kaif   Bipasha Basu   Bhagyashree,Romance,Raj Kanwar Akshay Kumar   Katrina Kaif   Bipasha Basu   Bhagyashree Romance
karam,Sanjay F. Gupta,John Abraham   Priyanka Chopra   Bharat Dabholkar   Vishwajeet Pradhan,Crime   Thriller,Sanjay F. Gupta John Abraham   Priyanka Chopra   Bharat Dabholkar   Vishwajeet Pradhan Crime   Thriller
main aisa hi hoon,Harry Baweja,Ajay Devgn   Sushmita Sen   Esha Deol   Anupam Kher,Musical   Drama,Harry Baweja Ajay Devgn   Sushmita Sen   Esha Deol   Anupam Kher Musical   Drama
tango charlie,Mani Shankar,Ajay Devgn   Bobby Deol   Sanjay Dutt   Sunil Shetty,Action   Drama   War,Mani Shankar Ajay Devgn   Bobby Deol   Sanjay Dutt   Sunil Shetty Action   Drama   War
tathastu,Anubhav Sinha,Sanjay Dutt   Ameesha Patel   Jayapradha   Gulshan Grover,Drama,Anubhav Sinha Sanjay Dutt   Ameesha Patel   Jayapradha   Gulshan Grover Drama
jurm,Vikram Bhatt,Bobby Deol   Lara Dutta   Milind Gunaji   Shakti Kapoor,Thriller,Vikram Bhatt Bobby Deol   Lara Dutta   Milind Gunaji   Shakti Kapoor Thriller
sheesha,Ashu Trikha,Neha Dhupia   Elidh MacQueen   Niju Mavani   Nares Ngamseera,Drama   Romance   Thriller,Ashu Trikha Neha Dhupia   Elidh MacQueen   Niju Mavani   Nares Ngamseera Drama   Romance   Thriller
kiss kis ko,Sharad Sharan,Chaitanya Bhosle   Sherrin Verghese   Bhumika Puri   Aparna Kumesh,Musical,Sharad Sharan Chaitanya Bhosle   Sherrin Verghese   Bhumika Puri   Aparna Kumesh Musical
chaahat ek nasha...,Jay Prakash   Surya Prakash,Aryan Vaid   Manisha Koirala   Preeti Jhangiani   Sharad S. Kapoor,Romance,Jay Prakash   Surya Prakash Aryan Vaid   Manisha Koirala   Preeti Jhangiani   Sharad S. Kapoor Romance
sins,Vinod Pande,Vinod Pande   Shiney Ahuja   Seema Rahmani,Drama   Romance,Vinod Pande Vinod Pande   Shiney Ahuja   Seema Rahmani Drama   Romance
bunty aur babli,Shaad Ali,Amitabh Bachchan   Rani Mukerji   Abhishek Bachchan   Kiran Juneja,Adventure   Comedy   Crime,Shaad Ali Amitabh Bachchan   Rani Mukerji   Abhishek Bachchan   Kiran Juneja Adventure   Comedy   Crime
banaras,Pankaj Parashar,Urmila Matondkar   Ashmit Patel   Dimple Kapadia   Raj Babbar,Musical   Drama,Pankaj Parashar Urmila Matondkar   Ashmit Patel   Dimple Kapadia   Raj Babbar Musical   Drama
dosti: friends forever,Suneel Darshan,Akshay Kumar   Bobby Deol   Kareena Kapoor   Lara Dutta,Romance,Suneel Darshan Akshay Kumar   Bobby Deol   Kareena Kapoor   Lara Dutta Romance
lucky: no time for love,Radhika Rao   Vinay Sapru,Salman Khan   Sneha Ullal   Mithun Chakraborty   Kader Khan,Musical   Drama   Romance,Radhika Rao   Vinay Sapru Salman Khan   Sneha Ullal   Mithun Chakraborty   Kader Khan Musical   Drama   Romance
shaadi no. 1,David Dhawan,Fardeen Khan   Zayed Khan   Sharman Joshi   Esha Deol,Comedy,David Dhawan Fardeen Khan   Zayed Khan   Sharman Joshi   Esha Deol Comedy
chehraa,Saurabh Shukla,Bipasha Basu   Dino Morea   Preeti Jhangiani   Irrfan Khan,Thriller,Saurabh Shukla Bipasha Basu   Dino Morea   Preeti Jhangiani   Irrfan Khan Thriller
hum dum,Kushan Nandy,Romit Raaj   Anjana Sukhani   Benjamin Gilani   Tanvi Azmi,Comedy   Romance,Kushan Nandy Romit Raaj   Anjana Sukhani   Benjamin Gilani   Tanvi Azmi Comedy   Romance
jodhaa akbar,Ashutosh Gowariker,Hrithik Roshan   Aishwarya Rai Bachchan   Sonu Sood   Poonam Sinha,Action   Adventure   Biography,Ashutosh Gowariker Hrithik Roshan   Aishwarya Rai Bachchan   Sonu Sood   Poonam Sinha Action   Adventure   Biography
kabhi alvida naa kehna,Karan Johar,Shah Rukh Khan   Rani Mukerji   Amitabh Bachchan   Preity Zinta,Drama,Karan Johar Shah Rukh Khan   Rani Mukerji   Amitabh Bachchan   Preity Zinta Drama
apaharan,Prakash Jha,Ajay Devgn   Nana Patekar   Bipasha Basu   Ayub Khan,Action   Crime   Drama,Prakash Jha Ajay Devgn   Nana Patekar   Bipasha Basu   Ayub Khan Action   Crime   Drama
bachke rehna re baba,Govind Menon,Rekha   Mallika Sherawat   Paresh Rawal   Satish Shah,Comedy,Govind Menon Rekha   Mallika Sherawat   Paresh Rawal   Satish Shah Comedy
kyon ki...,Priyadarshan,Salman Khan   Kareena Kapoor   Rimi Sen   Jackie Shroff,Drama   Romance,Priyadarshan Salman Khan   Kareena Kapoor   Rimi Sen   Jackie Shroff Drama   Romance
maine pyaar kyun kiya,David Dhawan,Salman Khan   Sushmita Sen   Katrina Kaif   Sohail Khan,Comedy   Drama   Romance,David Dhawan Salman Khan   Sushmita Sen   Katrina Kaif   Sohail Khan Comedy   Drama   Romance
my wife's murder,Jijy Philip,Anil Kapoor   Suchitra Krishnamoorthi   Nandana Sen   Rajesh Tandon,Thriller,Jijy Philip Anil Kapoor   Suchitra Krishnamoorthi   Nandana Sen   Rajesh Tandon Thriller
no entry,Anees Bazmee,Anil Kapoor   Salman Khan   Fardeen Khan   Bipasha Basu,Comedy   Drama   Musical,Anees Bazmee Anil Kapoor   Salman Khan   Fardeen Khan   Bipasha Basu Comedy   Drama   Musical
paheli,Amol Palekar,Shah Rukh Khan   Anupam Kher   Rani Mukerji   Amitabh Bachchan,Fantasy   Romance,Amol Palekar Shah Rukh Khan   Anupam Kher   Rani Mukerji   Amitabh Bachchan Fantasy   Romance
socha na tha,Imtiaz Ali,Abhay Deol   Ayesha Takia   Ayesha Jhulka   Apoorva Jha,Romance   Comedy,Imtiaz Ali Abhay Deol   Ayesha Takia   Ayesha Jhulka   Apoorva Jha Romance   Comedy
zeher,Mohit Suri,Emraan Hashmi   Shamita Shetty   Udita Goswami   Sameer Kochhar,Thriller,Mohit Suri Emraan Hashmi   Shamita Shetty   Udita Goswami   Sameer Kochhar Thriller
7 1/2 phere: more than a wedding,Ishaan Trivedi,Juhi Chawla   Irrfan Khan   Manoj Pahwa   Nina Kulkarni,Comedy   Drama,Ishaan Trivedi Juhi Chawla   Irrfan Khan   Manoj Pahwa   Nina Kulkarni Comedy   Drama
garam masala,Priyadarshan,Akshay Kumar   John Abraham   Paresh Rawal   Rimi Sen,Comedy,Priyadarshan Akshay Kumar   John Abraham   Paresh Rawal   Rimi Sen Comedy
iqbal,Nagesh Kukunoor,Naseeruddin Shah   Girish Karnad   Shreyas Talpade   Shweta Prasad,Drama,Nagesh Kukunoor Naseeruddin Shah   Girish Karnad   Shreyas Talpade   Shweta Prasad Drama
kuchh meetha ho jaye,Samar Khan,Arshad Warsi   Mahima Chaudhry   Parvin Dabas   Sandhya Mridul,Comedy   Romance,Samar Khan Arshad Warsi   Mahima Chaudhry   Parvin Dabas   Sandhya Mridul Comedy   Romance
aryan: unbreakable,Abhishek Kapoor,Sohail Khan   Sneha Ullal   Inder Kumar   Farida Jalal,Drama,Abhishek Kapoor Sohail Khan   Sneha Ullal   Inder Kumar   Farida Jalal Drama
chingaari,Kalpana Lajmi,Sushmita Sen   Mithun Chakraborty   Anuj Sawhney   Ila Arun,Drama,Kalpana Lajmi Sushmita Sen   Mithun Chakraborty   Anuj Sawhney   Ila Arun Drama
lage raho munna bhai,Rajkumar Hirani,Sanjay Dutt   Arshad Warsi   Vidya Balan   Boman Irani,Comedy   Drama   Romance,Rajkumar Hirani Sanjay Dutt   Arshad Warsi   Vidya Balan   Boman Irani Comedy   Drama   Romance
salaam namaste,Siddharth Anand,Saif Ali Khan   Preity Zinta   Arshad Warsi   Tania Zaetta,Comedy   Drama   Romance,Siddharth Anand Saif Ali Khan   Preity Zinta   Arshad Warsi   Tania Zaetta Comedy   Drama   Romance
fight club: members only,Vikram Chopra,Sunil Shetty   Sohail Khan   Zayed Khan   Dino Morea,Action   Comedy,Vikram Chopra Sunil Shetty   Sohail Khan   Zayed Khan   Dino Morea Action   Comedy
jaan-e-mann: let's fall in love... again,Shirish Kunder,Salman Khan   Akshay Kumar   Preity Zinta   Anupam Kher,Musical   Romance,Shirish Kunder Salman Khan   Akshay Kumar   Preity Zinta   Anupam Kher Musical   Romance
kyaa kool hai hum,Sangeeth Sivan,Tusshar Kapoor   Ritesh Deshmukh   Isha Koppikar   Neha Dhupia,Comedy   Mystery,Sangeeth Sivan Tusshar Kapoor   Ritesh Deshmukh   Isha Koppikar   Neha Dhupia Comedy   Mystery
mr ya miss,Antara Mali   Satchit Puranik,Antara Mali   Ritesh Deshmukh   Divya Dutta   Aftab Shivdasani,Comedy,Antara Mali   Satchit Puranik Antara Mali   Ritesh Deshmukh   Divya Dutta   Aftab Shivdasani Comedy
nazar,Soni Razdan,Meera   Ashmit Patel   Koel Purie   Neena Gupta,Thriller,Soni Razdan Meera   Ashmit Patel   Koel Purie   Neena Gupta Thriller
ek ajnabee,Apoorva Lakhia,Amitabh Bachchan   Arjun Rampal   Perizaad Zorabian   Rucha Vaidya,Action   Adventure   Crime,Apoorva Lakhia Amitabh Bachchan   Arjun Rampal   Perizaad Zorabian   Rucha Vaidya Action   Adventure   Crime
home delivery: aapko... ghar tak,Sujoy Ghosh,Vivek Oberoi   Mahima Chaudhry   Ayesha Takia   Boman Irani,Comedy   Romance,Sujoy Ghosh Vivek Oberoi   Mahima Chaudhry   Ayesha Takia   Boman Irani Comedy   Romance
mixed doubles,Rajat Kapoor,Konkona Sen Sharma   Ranvir Shorey   Koel Purie   Saurabh Shukla,Comedy   Drama,Rajat Kapoor Konkona Sen Sharma   Ranvir Shorey   Koel Purie   Saurabh Shukla Comedy   Drama
mumbai godfather,Deepak Balraj Vij,Seema Biswas   Vikram Singh   Bhumika   Govind Namdeo,Action   Crime   Drama,Deepak Balraj Vij Seema Biswas   Vikram Singh   Bhumika   Govind Namdeo Action   Crime   Drama
shabnam mausi,Yogesh Bharadwaj,Ashutosh Rana   Sujeet Chaubey   Divya Desai   Jasvvant Khera,Drama,Yogesh Bharadwaj Ashutosh Rana   Sujeet Chaubey   Divya Desai   Jasvvant Khera Drama
"gandhi, my father",Feroz Abbas Khan,Akshaye Khanna   Darshan Jariwala   Shefali Shetty   Bhoomika Chawla,Biography   Drama   History,Feroz Abbas Khan Akshaye Khanna   Darshan Jariwala   Shefali Shetty   Bhoomika Chawla Biography   Drama   History
kahaani gudiya ki...: true story of a woman,Prabhakar Shukla,Divya Dutta   Arif Zakaria   Rajpal Yadav   Somed Agarwal,Drama,Prabhakar Shukla Divya Dutta   Arif Zakaria   Rajpal Yadav   Somed Agarwal Drama
naam gum jaayega,Amol Shetge,Raqesh Vashisth   Dia Mirza   Aryan Vaid   Mandira Bedi,Thriller,Amol Shetge Raqesh Vashisth   Dia Mirza   Aryan Vaid   Mandira Bedi Thriller
eklavya: the royal guard,Vidhu Vinod Chopra,Amitabh Bachchan   Saif Ali Khan   Sanjay Dutt   Vidya Balan,Action   Drama   Thriller,Vidhu Vinod Chopra Amitabh Bachchan   Saif Ali Khan   Sanjay Dutt   Vidya Balan Action   Drama   Thriller
ek khiladi ek haseena,Suparn Verma,Fardeen Khan   Koena Mitra   Kay Kay Menon   Rakhi Sawant,Comedy   Crime   Thriller,Suparn Verma Fardeen Khan   Koena Mitra   Kay Kay Menon   Rakhi Sawant Comedy   Crime   Thriller
kal: yesterday and tomorrow,Ruchi Narain,Shiney Ahuja   Murad Ali   Ahmed Chaudhary   Gopi Desai,Drama   Mystery   Thriller,Ruchi Narain Shiney Ahuja   Murad Ali   Ahmed Chaudhary   Gopi Desai Drama   Mystery   Thriller
